{"channel":"radio2","slug":"musicunbound","streamVersion":1,"episodes":[{"id":"1132894","title":"","date":"2026-10-11","parts":["足本 Full (HKT 13:00 - 14:00)"]},{"id":"1131504","title":"","date":"2026-10-04","parts":["足本 Full (HKT 13:00 - 14:00)"]},{"id":"1130129","title":"","date":"2026-09-27","parts":["足本 Full (HKT 13:00 - 14:00)"]},{"id":"1128461","title":"主持﹕白原顥","date":"2026-09-20","parts":["足本 Full (HKT 13:00 - 14:00)"]},{"id":"1127024","title":"主持﹕秋璇","date":"2026-09-13","parts":["足本 Full (HKT 13:00 - 14:00)"]},{"id":"1125516","title":"主持﹕白原顥","date":"2026-09-06","parts":["足本 Full (HKT 13:00 - 14:00)"]},{"id":"1124074","title":"主持﹕秋璇","date":"2026-08-30","parts":["足本 Full (HKT 13:00 - 14:00)"]},{"id":"1122700","title":"主持﹕白原顥","date":"2026-08-23","parts":["足本 Full (HKT 13:00 - 14:00)"]},{"id":"1121275","title":"主持﹕秋璇","date":"2026-08-16","parts":["足本 Full (HKT 13:00 - 14:00)"]},{"id":"1119804","title":"主持﹕白原顥","date":"2026-08-09","parts":["足本 Full (HKT 13:00 - 14:00)"]},{"id":"1118411","title":"主持﹕秋璇","date":"2026-08-02","parts":["足本 Full (HKT 13:00 - 14:00)"]},{"id":"1116759","title":"由於颱風關係，節目暫停播放","date":"2026-07-26"},{"id":"1115023","title":"主持﹕秋璇","date":"2026-07-19","parts":["足本 Full (HKT 13:00 - 14:00)"]},{"id":"1113542","title":"主持﹕白原顥","date":"2026-07-12","parts":["足本 Full (HKT 13:00 - 14:00)"]},{"id":"1112045","title":"主持﹕秋璇","date":"2026-07-05","parts":["足本 Full (HKT 13:00 - 14:00)"]},{"id":"1110768","title":"主持﹕白原顥","date":"2026-06-28","parts":["足本 Full (HKT 13:00 - 14:00)"]},{"id":"1109223","title":"主持﹕秋璇","date":"2026-06-21","parts":["足本 Full (HKT 13:00 - 14:00)"]},{"id":"1107888","title":"主持﹕白原顥","date":"2026-06-14","parts":["足本 Full (HKT 13:00 - 14:00)"]},{"id":"1106479","title":"主持﹕秋璇","date":"2026-06-07","parts":["足本 Full (HKT 13:00 - 14:00)"]},{"id":"1105087","title":"主持﹕白原顥","date":"2026-05-31","parts":["足本 Full (HKT 13:00 - 14:00)"]},{"id":"1103613","title":"主持﹕秋璇","date":"2026-05-24","parts":["足本 Full (HKT 13:00 - 14:00)"]},{"id":"1102252","title":"主持﹕秋璇","date":"2026-05-17","parts":["足本 Full (HKT 13:00 - 14:00)"]},{"id":"1097751","title":"主持﹕白原顥","date":"2026-05-10","parts":["足本 Full (HKT 13:00 - 14:00)"]},{"id":"1096324","title":"主持﹕秋璇","date":"2026-05-03","parts":["足本 Full (HKT 13:00 - 14:00)"]},{"id":"1095028","title":"主持﹕白原顥","date":"2026-04-26","parts":["足本 Full (HKT 13:00 - 14:00)"]},{"id":"1092875","title":"主持﹕秋璇","date":"2026-04-19","parts":["足本 Full (HKT 13:00 - 14:00)"]},{"id":"1091518","title":"主持﹕白原顥","date":"2026-04-12","parts":["足本 Full (HKT 13:00 - 14:00)"]},{"id":"1090264","title":"主持﹕秋璇","date":"2026-04-05","parts":["足本 Full (HKT 13:00 - 14:00)"]}]}
