{"channel":"radio1","slug":"blue_globe_special","streamVersion":1,"episodes":[{"id":"1135565","title":"在生命中的選擇 - 李燦榮 / 綠氫產業急速起飛 - 源栢樑 / 板球重返奧運 - 王昭鴻 / 敘利亞裝修風格 - 蔡基瑋","date":"2026-10-26","parts":["足本 Full (HKT 02:04 - 02:35)"]},{"id":"1131455","title":"1318原則 - 李燦榮 / 伐林危機進逼中 - 源栢樑 / 基因改造的反思 - 李妍慧 / 用木棍度地球 - 蔡基瑋","date":"2026-10-19","parts":["足本 Full (HKT 02:04 - 02:35)"]},{"id":"1131454","title":"球星簽名球衣價格驚人 - 王昭鴻 / 鬼谷子 - 李燦榮 / 糧食危機 - 李妍慧 / 佛跳牆 - 蔡基瑋","date":"2026-10-12","parts":["足本 Full (HKT 02:04 - 02:35)"]},{"id":"1131453","title":"海洋熱浪令藍鯨變得安靜 - 邱焱 / 雪種 - 源栢樑 / 印度啤酒 - 蔡基瑋 / 顏色陷阱 - 鄭萃雯","date":"2026-10-05","parts":["足本 Full (HKT 02:04 - 02:35)"]},{"id":"1129898","title":"安慰劑效應 - 李燦榮 / 以色列如何規劃創科 - 源栢樑 / 歐洲古蹟現身 - 邱焱 / 黑色九月 - 蔡基瑋","date":"2026-09-28","parts":["足本 Full (HKT 02:04 - 02:35)"]},{"id":"1128574","title":"工程業界可放眼東盟新機遇 - 源栢樑 / 彭巴效應 - 蔡基瑋 / 滅火神器 - 鄭萃雯 / 需要時間來驗證的真理 - 李燦榮","date":"2026-09-21","parts":["足本 Full (HKT 02:04 - 02:35)"]},{"id":"1126835","title":"冷氣滴水 - 源栢樑 / 南極大王魷魚 - 蔡基瑋 / 猴食泥 - 鄭萃雯 / 粉紅色 - 馮兆寧","date":"2026-09-14","parts":["足本 Full (HKT 02:04 - 02:35)"]},{"id":"1125271","title":"變老 - 鄭萃雯 / 令人健康長壽的藥 - 邱焱 / 校園版AI - 林曉鋒 / 邪眼 - 蔡基瑋","date":"2026-09-07","parts":["足本 Full (HKT 02:04 - 02:35)"]},{"id":"1124175","title":"極端炎熱加快衰老 - 邱焱 / 可持續海鮮 - 李妍慧 / 臨兵鬥者皆陣列在前 - 蔡基瑋 / 消失的遺產 - 鄭萃雯","date":"2026-08-31","parts":["足本 Full (HKT 02:04 - 02:35)"]},{"id":"1122523","title":"壽命預測 - 李燦榮 / 科羅拉多河乾旱影響發電 - 邱焱 / 欠咗地球點樣還？ - 鄭萃雯 / 紅皇后效應 - 蔡基瑋","date":"2026-08-24","parts":["足本 Full (HKT 02:04 - 02:35)"]},{"id":"1121068","title":"樹懶演化史 - 邱焱 / 熱到冇啖好食 - 鄭萃雯 / NBA球隊薪資規定 - 王昭鴻 / 心花怒放 - 蔡基瑋","date":"2026-08-17","parts":["足本 Full (HKT 02:04 - 02:35)"]},{"id":"1119744","title":"達布哈藍洞 - 蔡基瑋 / 數碼鴻溝 - 林曉鋒 / 大西洋經向翻轉環流變弱 - 邱焱 / 長壽三大秘訣 - 李燦榮","date":"2026-08-10","parts":["足本 Full (HKT 02:04 - 02:35)"]},{"id":"1118182","title":"智慧醫療與可穿戴裝置 - 林曉鋒 / 毒梟的河馬 - 蔡基瑋 / 加州推行新食品日期標籤規定 - 邱焱 / 塞車費 - 鄭萃雯","date":"2026-08-03","parts":["足本 Full (HKT 02:04 - 02:35)"]},{"id":"1116575","title":"杜寧告魯克 - 李燦榮 / PM2.5 - 源栢樑 / 尖叫的教宗 - 蔡基瑋 / 循環廁 - 鄭萃雯","date":"2026-07-27","parts":["足本 Full (HKT 02:04 - 02:35)"]},{"id":"1115128","title":"口訣 - 李燦榮 / 鑽石是AI最好的朋友 - 邱焱 / 預測市場 - 蔡基瑋 / 地下王國 - 鄭萃雯","date":"2026-07-20","parts":["足本 Full (HKT 02:04 - 02:35)"]},{"id":"1113368","title":"英美球會建設女子足球場 - 邱焱 / 區塊鏈與數位資產 - 林曉鋒 / 玻璃幕牆 - 源栢樑 /  CCS 碳捕集 - 蔡基瑋","date":"2026-07-13","parts":["足本 Full (HKT 02:04 - 02:35)"]},{"id":"1111906","title":"海洋變暗 - 邱焱 / 拜科努爾太空發射場 - 蔡基瑋 / 賭波 - 李燦榮 / 銀蛇之都 - 梁榮武","date":"2026-07-06","parts":["足本 Full (HKT 02:04 - 02:35)"]},{"id":"1110603","title":"瓦罕走廊 - 蔡基瑋 / 綠色科技與碳管理 - 林曉鋒 / 世界盃漂綠 - 鄭萃雯 / 認清水資源價值 - 源栢樑","date":"2026-06-29","parts":["足本 Full (HKT 02:04 - 02:35)"]},{"id":"1109468","title":"古人對牛好 - 馮兆寧 / EROI - 蔡基瑋 / 鉛中毒 - 李燦榮 / 低空經濟與無人機 - 林曉鋒","date":"2026-06-22","parts":["足本 Full (HKT 02:04 - 02:35)"]},{"id":"1107725","title":"資源詛咒 - 蔡基瑋 / 減塑成真的路徑 - 源栢樑 / AI改變鍛鍊模式 - 王昭鴻 / 凱撒沙律 - 馮兆寧","date":"2026-06-15","parts":["足本 Full (HKT 02:04 - 02:35)"]},{"id":"1106295","title":"自由放任 - 馮兆寧 / 環保專家如何看待戰爭加劇氣候危機 - 蔡基瑋 / 食物中毒與氣候暖化 - 鄭萃雯 / 世界肥胖地圖 - 邱焱","date":"2026-06-08","parts":["足本 Full (HKT 02:04 - 02:35)"]},{"id":"1104934","title":"古老的降溫方法 - 邱焱 / 番梘回收 - 鄭萃雯 / 天球運行論 - 蔡基瑋 / 綠色看着舒服之謎 - 馮兆寧","date":"2026-06-01","parts":["足本 Full (HKT 02:04 - 02:35)"]},{"id":"1103539","title":"島嶼侏儒化現象 - 蔡基瑋 / 城市沉降是一個被低估的沿海危機 - 源栢樑 / 運動盛事經濟 - 王昭鴻 / 中國成語退避三舍 - 李燦榮","date":"2026-05-25","parts":["足本 Full (HKT 02:04 - 02:35)"]},{"id":"1102188","title":"鹽與錢 - 馮兆寧 / 咪做大嘥鬼 - 鄭萃雯 / AI 助修復古畫 - 邱焱 / 庫爾德人千年抗爭 - 蔡基瑋","date":"2026-05-18","parts":["足本 Full (HKT 02:04 - 02:35)"]},{"id":"1097865","title":"太平洋火環 - 梁榮武 / 國際能源發展新路向 - 源栢樑 / 大冤案 - 蔡基瑋 / 得閒飲茶 - 鄭萃雯","date":"2026-05-11","parts":["足本 Full (HKT 02:04 - 02:35)"]},{"id":"1096165","title":"古人吃菜史 - 馮兆寧 / 綠化校園 - 鄭萃雯 / 生成式 AI 人人都有的智能助手 - 林曉鋒 / 六分儀 - 蔡基瑋","date":"2026-05-04","parts":["足本 Full (HKT 02:04 - 02:35)"]},{"id":"1094811","title":"西洋黃 - 馮兆寧 / 食空氣 - 鄭萃雯 / 腓力四世 - 蔡基瑋 / 全球運動員收入榜 - 王昭鴻","date":"2026-04-27","parts":["足本 Full (HKT 02:04 - 02:35)"]},{"id":"1092800","title":"AI小龍蝦 - 李燦榮 / 法國的鐵路馬路兩用車 - 邱焱 / 巴格達電池 - 蔡基瑋 / 氣候變化與民生代價 - 源栢樑","date":"2026-04-20","parts":["足本 Full (HKT 02:04 - 02:35)"]},{"id":"1091287","title":"古代貓名字 - 馮兆寧 / 夜班火車 - 譚永標 / 電動車廢棄電池的挑戰 - 源栢樑 / Wojtek - 蔡基瑋","date":"2026-04-13","parts":["足本 Full (HKT 02:04 - 02:35)"]},{"id":"1090364","title":"尼莫點 - 蔡基瑋 / 河流釋出大量年代久遠的碳 - 邱焱 / 想節能輪軚能 - 鄭萃雯 / 綠色看著舒服之謎 - 馮兆寧","date":"2026-04-06","parts":["足本 Full (HKT 02:04 - 02:35)"]},{"id":"1088628","title":"鯨落 / 島國用數碼技術自救 / 囚徒困境 / 愚人節談「愚」","date":"2026-03-30","parts":["足本 Full (HKT 02:04 - 02:35)"]},{"id":"1087173","title":"農業新寵兒 / 反饑荒之樹 / 魚子醬 / NBA單場第二高分","date":"2026-03-23","parts":["足本 Full (HKT 02:04 - 02:35)"]},{"id":"1085763","title":"為什麼有另一個胃裝甜品 / 塑膠巢穴 / 2026伊朗局勢與美國策略 / 老公實解太監","date":"2026-03-16","parts":["足本 Full (HKT 02:04 - 02:35)"]},{"id":"1084595","title":"肥胖新定義 / 長壽有機 / 人類質量 / 馬知道你的不安","date":"2026-03-09","parts":["足本 Full (HKT 02:04 - 02:35)"]},{"id":"1082799","title":"買來的新奧爾良 / 安提基特拉機械 / 新派儀式感 / 舞獅","date":"2026-03-02","parts":["足本 Full (HKT 02:04 - 02:35)"]},{"id":"1081780","title":"小星星 / 消失的十天 / 捉條鯊魚入魚缸 / 鹽和錢","date":"2026-02-23","parts":["足本 Full (HKT 02:04 - 02:35)"]},{"id":"1080659","title":"你我他的身影 / 籃球3分線嘅由來 / 大博弈 / 全球河口三角洲沉降","date":"2026-02-16","parts":["足本 Full (HKT 02:04 - 02:35)"]},{"id":"1079194","title":"淨土 / 華氏 / 吉布斯自由能 / 尼泊爾提出五年計劃清潔艾菲爾士峰","date":"2026-02-09","parts":["足本 Full (HKT 02:04 - 02:35)"]},{"id":"1077740","title":"大型窗殺事件簿 / 17隻羊 / 拓撲圖 / 環保地喝紅酒","date":"2026-02-02","parts":["足本 Full (HKT 02:04 - 02:35)"]},{"id":"1076323","title":"女士還是先生 / 木衛二 / 道德判斷三個層次 / 澳網「大搞作」","date":"2026-01-26","parts":["足本 Full (HKT 02:04 - 02:35)"]},{"id":"1073523","title":"大博弈 / I OR E / 廁所無廁紙 / 德國人發明農曆","date":"2026-01-19","parts":["足本 Full (HKT 02:04 - 02:35)"]},{"id":"1072363","title":"Emoji 解讀差異 / 進入人工智能年代 / 寒武紀大爆發 / 海洋獅子","date":"2026-01-12","parts":["足本 Full (HKT 02:04 - 02:35)"]},{"id":"1070577","title":"器官老化速度大不同 / P vs NP 問題 / 史丹福的商業管理課 / BabyShark","date":"2026-01-05","parts":["足本 Full (HKT 02:04 - 02:35)"]},{"id":"1069172","title":"海上太陽能 / 10時10分 / 賽克斯-皮科協定 / 北極熊","date":"2025-12-29","parts":["足本 Full (HKT 02:04 - 02:35)"]},{"id":"1067995","title":"學立歸群 / 地球上有生命嗎 / 伊拉克世紀銀行劫案 / 世上最幼細意粉","date":"2025-12-22","parts":["足本 Full (HKT 02:04 - 02:35)"]},{"id":"1066546","title":"神蹟 / BEAUTY / 動物糞便造紙 / 寒武紀大爆發","date":"2025-12-15","parts":["足本 Full (HKT 02:04 - 02:35)"]},{"id":"1065166","title":"洗澡假 / AI減剩食 / 早發性癌症增加 / 拓撲圖","date":"2025-12-08","parts":["足本 Full (HKT 02:04 - 02:35)"]},{"id":"1063665","title":"MERRY / 器官老化速度大不同 / 史上首富 / 北極熊","date":"2025-12-01","parts":["足本 Full (HKT 02:04 - 02:35)"]},{"id":"1062171","title":"綠色手術袍 / 培養未來所需技能 / 世上最幼細的意粉 / 義工歷史","date":"2025-11-24","parts":["足本 Full (HKT 02:04 - 02:35)"]},{"id":"1060641","title":"雛菊隨想 / 蚊 / 熊出沒注意 / 追蹤聖誕老人","date":"2025-11-17","parts":["足本 Full (HKT 02:04 - 02:35)"]},{"id":"1059097","title":"從天花談起 / 維他命沒F-J / 閏年 / 強盜洞","date":"2025-11-10","parts":["足本 Full (HKT 02:04 - 02:35)"]},{"id":"1057561","title":"頁岩油革命 / 神奇的貼紙 / 大海雀 / 戲院座椅紅色","date":"2025-11-03","parts":["足本 Full (HKT 02:04 - 02:35)"]}]}
