{"channel":"radio4","slug":"saturdaymorningon4","streamVersion":1,"episodes":[{"id":"1134160","title":"","date":"2026-10-17","parts":["足本 Full (HKT 07:05 - 09:00)","第一部份 Part 1 (HKT 07:05 - 08:00)","第二部份 Part 2 (HKT 08:05 - 09:00)"]},{"id":"1132795","title":"","date":"2026-10-10","parts":["足本 Full (HKT 07:05 - 09:00)","第一部份 Part 1 (HKT 07:05 - 08:00)","第二部份 Part 2 (HKT 08:05 - 09:00)"]},{"id":"1131376","title":"","date":"2026-10-03","parts":["足本 Full (HKT 07:05 - 09:00)","第一部份 Part 1 (HKT 07:05 - 08:00)","第二部份 Part 2 (HKT 08:05 - 09:00)"]},{"id":"1130025","title":"","date":"2026-09-26","parts":["足本 Full (HKT 07:05 - 09:00)","第一部份 Part 1 (HKT 07:05 - 08:00)","第二部份 Part 2 (HKT 08:05 - 09:00)"]},{"id":"1128348","title":"","date":"2026-09-19","parts":["足本 Full (HKT 07:05 - 09:00)","第一部份 Part 1 (HKT 07:05 - 08:00)","第二部份 Part 2 (HKT 08:05 - 09:00)"]},{"id":"1126926","title":"","date":"2026-09-12","parts":["足本 Full (HKT 07:05 - 09:00)","第一部份 Part 1 (HKT 07:05 - 08:00)","第二部份 Part 2 (HKT 08:05 - 09:00)"]},{"id":"1125401","title":"","date":"2026-09-05","parts":["足本 Full (HKT 07:05 - 09:00)","第一部份 Part 1 (HKT 07:05 - 08:00)","第二部份 Part 2 (HKT 08:05 - 09:00)"]},{"id":"1123966","title":"","date":"2026-08-29","parts":["足本 Full (HKT 07:05 - 09:00)","第一部份 Part 1 (HKT 07:05 - 08:00)","第二部份 Part 2 (HKT 08:05 - 09:00)"]},{"id":"1122593","title":"","date":"2026-08-22","parts":["足本 Full (HKT 07:05 - 09:00)","第一部份 Part 1 (HKT 07:05 - 08:00)","第二部份 Part 2 (HKT 08:05 - 09:00)"]},{"id":"1121171","title":"","date":"2026-08-15","parts":["足本 Full (HKT 07:05 - 09:00)","第一部份 Part 1 (HKT 07:05 - 08:00)","第二部份 Part 2 (HKT 08:05 - 09:00)"]},{"id":"1119780","title":"","date":"2026-08-08","parts":["足本 Full (HKT 07:05 - 09:00)","第一部份 Part 1 (HKT 07:05 - 08:00)","第二部份 Part 2 (HKT 08:05 - 09:00)"]},{"id":"1118298","title":"","date":"2026-08-01","parts":["足本 Full (HKT 07:05 - 09:00)","第一部份 Part 1 (HKT 07:05 - 08:00)","第二部份 Part 2 (HKT 08:05 - 09:00)"]},{"id":"1116736","title":"","date":"2026-07-25","parts":["足本 Full (HKT 07:05 - 09:00)","第一部份 Part 1 (HKT 07:05 - 08:00)","第二部份 Part 2 (HKT 08:05 - 09:00)"]},{"id":"1115253","title":"","date":"2026-07-18","parts":["足本 Full (HKT 07:05 - 09:00)","第一部份 Part 1 (HKT 07:05 - 08:00)","第二部份 Part 2 (HKT 08:05 - 09:00)"]},{"id":"1113516","title":"","date":"2026-07-11","parts":["足本 Full (HKT 07:05 - 09:00)","第一部份 Part 1 (HKT 07:05 - 08:00)","第二部份 Part 2 (HKT 08:05 - 09:00)"]},{"id":"1112012","title":"","date":"2026-07-04","parts":["足本 Full (HKT 07:05 - 09:00)","第一部份 Part 1 (HKT 07:05 - 08:00)","第二部份 Part 2 (HKT 08:05 - 09:00)"]},{"id":"1110746","title":"","date":"2026-06-27","parts":["足本 Full (HKT 07:05 - 09:00)","第一部份 Part 1 (HKT 07:05 - 08:00)","第二部份 Part 2 (HKT 08:05 - 09:00)"]},{"id":"1109261","title":"","date":"2026-06-20","parts":["足本 Full (HKT 07:05 - 09:00)","第一部份 Part 1 (HKT 07:05 - 08:00)","第二部份 Part 2 (HKT 08:05 - 09:00)"]},{"id":"1107768","title":"","date":"2026-06-13","parts":["足本 Full (HKT 07:05 - 09:00)","第一部份 Part 1 (HKT 07:05 - 08:00)","第二部份 Part 2 (HKT 08:05 - 09:00)"]},{"id":"1106386","title":"","date":"2026-06-06","parts":["足本 Full (HKT 07:05 - 09:00)","第一部份 Part 1 (HKT 07:05 - 08:00)","第二部份 Part 2 (HKT 08:05 - 09:00)"]},{"id":"1104974","title":"","date":"2026-05-30","parts":["足本 Full (HKT 07:05 - 09:00)","第一部份 Part 1 (HKT 07:05 - 08:00)","第二部份 Part 2 (HKT 08:05 - 09:00)"]},{"id":"1103648","title":"","date":"2026-05-23","parts":["足本 Full (HKT 07:05 - 09:00)","第一部份 Part 1 (HKT 07:05 - 08:00)","第二部份 Part 2 (HKT 08:05 - 09:00)"]},{"id":"1102228","title":"","date":"2026-05-16","parts":["足本 Full (HKT 07:05 - 09:00)","第一部份 Part 1 (HKT 07:05 - 08:00)","第二部份 Part 2 (HKT 08:05 - 09:00)"]},{"id":"1097634","title":"","date":"2026-05-09","parts":["足本 Full (HKT 07:05 - 09:00)","第一部份 Part 1 (HKT 07:05 - 08:00)","第二部份 Part 2 (HKT 08:05 - 09:00)"]},{"id":"1096216","title":"","date":"2026-05-02","parts":["足本 Full (HKT 07:05 - 09:00)","第一部份 Part 1 (HKT 07:05 - 08:00)","第二部份 Part 2 (HKT 08:05 - 09:00)"]},{"id":"1094921","title":"","date":"2026-04-25","parts":["足本 Full (HKT 07:05 - 09:00)","第一部份 Part 1 (HKT 07:05 - 08:00)","第二部份 Part 2 (HKT 08:05 - 09:00)"]},{"id":"1092848","title":"","date":"2026-04-18","parts":["足本 Full (HKT 07:05 - 09:00)","第一部份 Part 1 (HKT 07:05 - 08:00)","第二部份 Part 2 (HKT 08:05 - 09:00)"]},{"id":"1091412","title":"","date":"2026-04-11","parts":["足本 Full (HKT 07:05 - 09:00)","第一部份 Part 1 (HKT 07:05 - 08:00)","第二部份 Part 2 (HKT 08:05 - 09:00)"]},{"id":"1090172","title":"","date":"2026-04-04","parts":["足本 Full (HKT 07:05 - 09:00)","第一部份 Part 1 (HKT 07:05 - 08:00)","第二部份 Part 2 (HKT 08:05 - 09:00)"]},{"id":"1088726","title":"","date":"2026-03-28","parts":["足本 Full (HKT 07:05 - 09:00)","第一部份 Part 1 (HKT 07:05 - 08:00)","第二部份 Part 2 (HKT 08:05 - 09:00)"]},{"id":"1087217","title":"","date":"2026-03-21","parts":["足本 Full (HKT 07:05 - 09:00)","第一部份 Part 1 (HKT 07:05 - 08:00)","第二部份 Part 2 (HKT 08:05 - 09:00)"]},{"id":"1085802","title":"","date":"2026-03-14","parts":["足本 Full (HKT 07:05 - 09:00)","第一部份 Part 1 (HKT 07:05 - 08:00)","第二部份 Part 2 (HKT 08:05 - 09:00)"]},{"id":"1084400","title":"","date":"2026-03-07","parts":["足本 Full (HKT 07:05 - 09:00)","第一部份 Part 1 (HKT 07:05 - 08:00)","第二部份 Part 2 (HKT 08:05 - 09:00)"]},{"id":"1082838","title":"","date":"2026-02-28","parts":["足本 Full (HKT 07:05 - 09:00)","第一部份 Part 1 (HKT 07:05 - 08:00)","第二部份 Part 2 (HKT 08:05 - 09:00)"]},{"id":"1081578","title":"","date":"2026-02-21","parts":["足本 Full (HKT 07:05 - 09:00)","第一部份 Part 1 (HKT 07:05 - 08:00)","第二部份 Part 2 (HKT 08:05 - 09:00)"]},{"id":"1080441","title":"","date":"2026-02-14","parts":["足本 Full (HKT 07:05 - 09:00)","第一部份 Part 1 (HKT 07:05 - 08:00)","第二部份 Part 2 (HKT 08:05 - 09:00)"]},{"id":"1078942","title":"","date":"2026-02-07","parts":["足本 Full (HKT 07:05 - 09:00)","第一部份 Part 1 (HKT 07:05 - 08:00)","第二部份 Part 2 (HKT 08:05 - 09:00)"]},{"id":"1077495","title":"","date":"2026-01-31","parts":["足本 Full (HKT 07:05 - 09:00)","第一部份 Part 1 (HKT 07:05 - 08:00)","第二部份 Part 2 (HKT 08:05 - 09:00)"]},{"id":"1076142","title":"","date":"2026-01-24","parts":["足本 Full (HKT 07:05 - 09:00)","第一部份 Part 1 (HKT 07:05 - 08:00)","第二部份 Part 2 (HKT 08:05 - 09:00)"]},{"id":"1073615","title":"","date":"2026-01-17","parts":["足本 Full (HKT 07:05 - 09:00)","第一部份 Part 1 (HKT 07:05 - 08:00)","第二部份 Part 2 (HKT 08:05 - 09:00)"]},{"id":"1072161","title":"","date":"2026-01-10","parts":["足本 Full (HKT 07:05 - 09:00)","第一部份 Part 1 (HKT 07:05 - 08:00)","第二部份 Part 2 (HKT 08:05 - 09:00)"]},{"id":"1070374","title":"","date":"2026-01-03","parts":["足本 Full (HKT 07:05 - 09:00)","第一部份 Part 1 (HKT 07:05 - 08:00)","第二部份 Part 2 (HKT 08:05 - 09:00)"]},{"id":"1068998","title":"","date":"2025-12-27","parts":["足本 Full (HKT 07:05 - 09:00)","第一部份 Part 1 (HKT 07:05 - 08:00)","第二部份 Part 2 (HKT 08:05 - 09:00)"]},{"id":"1067764","title":"","date":"2025-12-20","parts":["足本 Full (HKT 07:05 - 09:00)","第一部份 Part 1 (HKT 07:05 - 08:00)","第二部份 Part 2 (HKT 08:05 - 09:00)"]},{"id":"1066318","title":"","date":"2025-12-13","parts":["足本 Full (HKT 07:05 - 09:00)","第一部份 Part 1 (HKT 07:05 - 08:00)","第二部份 Part 2 (HKT 08:05 - 09:00)"]},{"id":"1064931","title":"","date":"2025-12-06","parts":["足本 Full (HKT 07:05 - 09:00)","第一部份 Part 1 (HKT 07:05 - 08:00)","第二部份 Part 2 (HKT 08:05 - 09:00)"]},{"id":"1063420","title":"","date":"2025-11-29","parts":["足本 Full (HKT 07:05 - 09:00)","第一部份 Part 1 (HKT 07:05 - 08:00)","第二部份 Part 2 (HKT 08:05 - 09:00)"]},{"id":"1061894","title":"","date":"2025-11-22","parts":["足本 Full (HKT 07:05 - 09:00)","第一部份 Part 1 (HKT 07:05 - 08:00)","第二部份 Part 2 (HKT 08:05 - 09:00)"]},{"id":"1060369","title":"","date":"2025-11-15","parts":["足本 Full (HKT 07:05 - 09:00)","第一部份 Part 1 (HKT 07:05 - 08:00)","第二部份 Part 2 (HKT 08:05 - 09:00)"]},{"id":"1058870","title":"","date":"2025-11-08","parts":["足本 Full (HKT 07:05 - 09:00)","第一部份 Part 1 (HKT 07:05 - 08:00)","第二部份 Part 2 (HKT 08:05 - 09:00)"]},{"id":"1057347","title":"","date":"2025-11-01","parts":["足本 Full (HKT 07:05 - 09:00)","第一部份 Part 1 (HKT 07:05 - 08:00)","第二部份 Part 2 (HKT 08:05 - 09:00)"]}]}
