{"channel":"radio1","slug":"CareForDisabled","streamVersion":1,"episodes":[{"id":"1128701","title":"認知障礙長者話劇計劃「Good Show」：以話劇 跨越認知障礙","date":"2026-10-18","parts":["足本 Full (HKT 13:00 - 14:00)"]},{"id":"1128700","title":"盲人輔導會盲人工廠經理 陳凌慧：以雙手代替雙眼","date":"2026-10-11","parts":["足本 Full (HKT 13:00 - 14:00)"]},{"id":"1128699","title":"社企「運動傳承」：以運動實踐文化共融","date":"2026-10-04","parts":["足本 Full (HKT 13:00 - 14:00)"]},{"id":"1119692","title":"輪椅舞蹈運動員 余俊延：輪椅舞蹈初認識","date":"2026-09-27","parts":["足本 Full (HKT 13:00 - 14:00)"]},{"id":"1119691","title":"香港耀能協會 新界西綜合社區康復中心：攜手跨過「風」暴","date":"2026-09-20","parts":["足本 Full (HKT 13:00 - 14:00)"]},{"id":"1119690","title":"香港復康力量音樂藝術學苑：無障礙的音樂夢","date":"2026-09-13","parts":["足本 Full (HKT 13:00 - 14:00)"]},{"id":"1119689","title":"香港傷健協會：走入「共融村」","date":"2026-09-06","parts":["足本 Full (HKT 13:00 - 14:00)"]},{"id":"1114915","title":"不一樣的考生","date":"2026-08-30","parts":["足本 Full (HKT 13:00 - 14:00)"]},{"id":"1114914","title":"第四屆《9.23國際手語日》展覽","date":"2026-08-23","parts":["足本 Full (HKT 13:00 - 14:00)"]},{"id":"1114913","title":"生命熱線 賽馬會坪石服務中心 重新啟用","date":"2026-08-16","parts":["足本 Full (HKT 13:00 - 14:00)"]},{"id":"1114912","title":"《藝・遊》智力與發展障礙朋友的創意遊蹤","date":"2026-08-09","parts":["足本 Full (HKT 13:00 - 14:00)"]},{"id":"1114911","title":"特殊校長無障礙的愛","date":"2026-08-02","parts":["足本 Full (HKT 13:00 - 14:00)"]},{"id":"1117247","title":"因風暴影響，暫停播出一次","date":"2026-07-26"},{"id":"1109938","title":"「花轆 Look」輪椅花車巡遊","date":"2026-07-19","parts":["足本 Full (HKT 13:00 - 14:00)"]},{"id":"1109937","title":"科技研發公司工程師方汶鑒：以科技重拾腳步","date":"2026-07-12","parts":["足本 Full (HKT 13:00 - 14:00)"]},{"id":"1109936","title":"基督教家庭服務中心：跨出第一步 衝破溝通障礙","date":"2026-07-05","parts":["足本 Full (HKT 13:00 - 14:00)"]},{"id":"1106279","title":"復康力量主席 葉湛溪：殘疾人士的就業與創業","date":"2026-06-28","parts":["足本 Full (HKT 13:00 - 14:00)"]},{"id":"1106278","title":"不一樣的父親節：唐氏朋友與爸爸的生命故事","date":"2026-06-21","parts":["足本 Full (HKT 13:00 - 14:00)"]},{"id":"1106277","title":"鄰舍輔導會「特能龍舟隊」","date":"2026-06-14","parts":["足本 Full (HKT 13:00 - 14:00)"]},{"id":"1106276","title":"以多媒體創作消除精神病的污名：精神科專科醫生 羅嘉瑩醫生","date":"2026-06-07","parts":["足本 Full (HKT 13:00 - 14:00)"]},{"id":"1090486","title":"殘疾運動員大使計劃：殘疾運動員大使 付遠威、蔡詠琪、中國香港殘疾人奧委會高級項目發展經理 王明蔚","date":"2026-05-31","parts":["足本 Full (HKT 13:00 - 14:00)"]},{"id":"1090485","title":"盲人觀星傷健營：盲人觀星傷健營活動顧問 許宗盛、莫儉榮","date":"2026-05-24","parts":["足本 Full (HKT 13:00 - 14:00)"]},{"id":"1090484","title":"運動是良藥：中國香港體適能總會行政總監 黃永森博士、肝臟移植協康會資深義工 唐敬星","date":"2026-05-17","parts":["足本 Full (HKT 13:00 - 14:00)"]},{"id":"1090483","title":"耀能話劇展潛能：香港耀能協會賽馬會田綺玲學校師生","date":"2026-05-10","parts":["足本 Full (HKT 13:00 - 14:00)"]},{"id":"1090482","title":"初心足球會梁志權、袁嘉捷、劉景賢：初心足球","date":"2026-05-03","parts":["足本 Full (HKT 13:00 - 14:00)"]},{"id":"1088559","title":"青年導師阿軒、黃厚豐：青年夢工場","date":"2026-04-26","parts":["足本 Full (HKT 13:00 - 14:00)"]},{"id":"1088558","title":"徐江琼、陳浩彰：SEN音樂確實動聽","date":"2026-04-19","parts":["足本 Full (HKT 13:00 - 14:00)"]},{"id":"1088557","title":"紀錄片導演詹家俊、演員鄭沛彣：以紀錄片突破聽障人士語言界限","date":"2026-04-12","parts":["足本 Full (HKT 13:00 - 14:00)"]},{"id":"1088556","title":"香港關懷力量會長 呂之德Jacky ：沿路伴「您」","date":"2026-04-05","parts":["足本 Full (HKT 13:00 - 14:00)"]},{"id":"1082118","title":"自強協會計劃主任 葉偉強、輪椅美工師 吳錦羨：輪椅美工顯關懷","date":"2026-03-29","parts":["足本 Full (HKT 13:00 - 14:00)"]},{"id":"1082117","title":"烘焙社企創辦人、讀寫障礙患者 周欣璇Jenny：「小薯仔 ‧ 大夢想」","date":"2026-03-22","parts":["足本 Full (HKT 13:00 - 14:00)"]},{"id":"1082116","title":"傷健人士汽車改裝師傅 范道生、改裝車車主 顏楚漢：傷健人士駕駛知多啲","date":"2026-03-15","parts":["足本 Full (HKT 13:00 - 14:00)"]},{"id":"1082115","title":"獅子會愛心慈善跑","date":"2026-03-08","parts":["足本 Full (HKT 13:00 - 14:00)"]},{"id":"1082114","title":"「無障行者」 - 無障城市追擊「搜」","date":"2026-03-01","parts":["足本 Full (HKT 13:00 - 14:00)"]},{"id":"1076437","title":"非常人物陪你過「非常」新年","date":"2026-02-22","parts":["足本 Full (HKT 13:00 - 14:00)"]},{"id":"1076436","title":"共融旅行團：極地同行主席、油尖旺區健康城市執行委員會 盧俊賢 Steve","date":"2026-02-15","parts":["足本 Full (HKT 13:00 - 14:00)"]},{"id":"1077407","title":"關匯計劃 Project i-Care ‧ 即時視像手語翻譯助市民","date":"2026-02-08","parts":["足本 Full (HKT 13:00 - 14:00)"]},{"id":"1075754","title":"「不倒翁」視障跑手梁小偉：籌備1800公里 粵港澳大灣區慈善跑","date":"2026-02-01","parts":["足本 Full (HKT 13:00 - 14:00)"]},{"id":"1075753","title":"以藝術自我改變","date":"2026-01-25","parts":["足本 Full (HKT 13:00 - 14:00)"]},{"id":"1073729","title":"以「劇本殺」學習心理健康","date":"2026-01-18","parts":["足本 Full (HKT 13:00 - 14:00)"]},{"id":"1070739","title":"第二屆「活力龍舟共融盃」","date":"2026-01-11","parts":["足本 Full (HKT 13:00 - 14:00)"]},{"id":"1069161","title":"新主持： 殘疾人羽毛球運動員王鎮炎","date":"2026-01-04","parts":["足本 Full (HKT 13:00 - 14:00)"]},{"id":"1069079","title":"無障礙牙科護理：「再現歡顏」創辦人張啟遠","date":"2025-12-28","parts":["足本 Full (HKT 13:00 - 14:00)"]},{"id":"1065279","title":"「照顧者快線」長者與復康服務","date":"2025-12-21","parts":["足本 Full (HKT 13:00 - 14:00)"]},{"id":"1065278","title":"香港隊田徑運動員 嚴鉦熙：不一樣的田徑、不一樣的備戰","date":"2025-12-14","parts":["足本 Full (HKT 13:00 - 14:00)"]},{"id":"1065061","title":"表達藝術治療師 陳煥婷：如何以藝術幫助SEN表達自己","date":"2025-12-07","parts":["足本 Full (HKT 13:00 - 14:00)"]},{"id":"1062153","title":"明愛賽馬會照顧者資源及支援中心：關顧照顧者","date":"2025-11-30","parts":["足本 Full (HKT 13:00 - 14:00)"]},{"id":"1062029","title":"基督教靈實協會「舒筋樂活新里程」：踏上新里程","date":"2025-11-23","parts":["足本 Full (HKT 13:00 - 14:00)"]},{"id":"1060470","title":"親和藝術慈善基金：SEN學童進步獎","date":"2025-11-16","parts":["足本 Full (HKT 13:00 - 14:00)"]},{"id":"1058984","title":"中醫善堂朱國棟醫師、葉偉康醫師：贈醫施藥","date":"2025-11-09","parts":["足本 Full (HKT 13:00 - 14:00)"]},{"id":"1057442","title":"香港弱智人士家長聯會：發揮互助力量","date":"2025-11-02","parts":["足本 Full (HKT 13:00 - 14:00)"]}]}
