{"channel":"radio4","slug":"sundayclassics","streamVersion":1,"episodes":[{"id":"1127057","title":"Sunday Classics 周日古典","date":"2026-09-13","parts":["足本 Full (HKT 20:00 - 22:00)","第一部份 Part 1 (HKT 20:05 - 21:00)","第二部份 Part 2 (HKT 21:05 - 22:00)"]},{"id":"1125549","title":"Sunday Classics 周日古典","date":"2026-09-06","parts":["足本 Full (HKT 20:05 - 22:00)","第一部份 Part 1 (HKT 20:05 - 21:00)","第二部份 Part 2 (HKT 21:05 - 22:00)"]},{"id":"1124103","title":"Sunday Classics 周日古典","date":"2026-08-30","parts":["足本 Full (HKT 20:05 - 22:00)","第一部份 Part 1 (HKT 20:05 - 21:00)","第二部份 Part 2 (HKT 21:05 - 22:00)"]},{"id":"1122731","title":"Sunday Classics 周日古典","date":"2026-08-23","parts":["足本 Full (HKT 20:05 - 22:00)","第一部份 Part 1 (HKT 20:05 - 21:00)","第二部份 Part 2 (HKT 21:05 - 22:00)"]},{"id":"1121306","title":"Sunday Classics 周日古典","date":"2026-08-16","parts":["足本 Full (HKT 20:05 - 22:00)","第一部份 Part 1 (HKT 20:05 - 21:00)","第二部份 Part 2 (HKT 21:05 - 22:00)"]},{"id":"1119921","title":"Sunday Classics 周日古典","date":"2026-08-09","parts":["足本 Full (HKT 20:05 - 22:00)","第一部份 Part 1 (HKT 20:05 - 21:00)","第二部份 Part 2 (HKT 21:05 - 22:00)"]},{"id":"1118443","title":"Sunday Classics 周日古典","date":"2026-08-02","parts":["足本 Full (HKT 20:05 - 22:00)","第一部份 Part 1 (HKT 20:05 - 21:00)","第二部份 Part 2 (HKT 21:05 - 22:00)"]},{"id":"1116947","title":"Sunday Classics 周日古典","date":"2026-07-26","parts":["足本 Full (HKT 20:05 - 22:00)","第一部份 Part 1 (HKT 20:05 - 21:00)","第二部份 Part 2 (HKT 21:05 - 22:00)"]},{"id":"1115381","title":"Sunday Classics 周日古典","date":"2026-07-19","parts":["足本 Full (HKT 20:05 - 22:00)","第一部份 Part 1 (HKT 20:05 - 21:00)","第二部份 Part 2 (HKT 21:05 - 22:00)"]},{"id":"1113642","title":"Sunday Classics 周日古典","date":"2026-07-12","parts":["足本 Full (HKT 20:05 - 22:00)","第一部份 Part 1 (HKT 20:05 - 21:00)","第二部份 Part 2 (HKT 21:05 - 22:00)"]},{"id":"1112161","title":"Sunday Classics 周日古典","date":"2026-07-05","parts":["足本 Full (HKT 20:05 - 22:00)","第一部份 Part 1 (HKT 20:05 - 21:00)","第二部份 Part 2 (HKT 21:05 - 22:00)"]},{"id":"1110866","title":"Sunday Classics 周日古典","date":"2026-06-28","parts":["足本 Full (HKT 20:05 - 22:00)","第一部份 Part 1 (HKT 20:05 - 21:00)","第二部份 Part 2 (HKT 21:05 - 22:00)"]},{"id":"1109399","title":"Sunday Classics 周日古典","date":"2026-06-21","parts":["足本 Full (HKT 20:05 - 22:00)","第一部份 Part 1 (HKT 20:05 - 21:00)","第二部份 Part 2 (HKT 21:05 - 22:00)"]},{"id":"1107919","title":"Sunday Classics 周日古典","date":"2026-06-14","parts":["足本 Full (HKT 20:05 - 22:00)","第一部份 Part 1 (HKT 20:05 - 21:00)","第二部份 Part 2 (HKT 21:05 - 22:00)"]},{"id":"1106511","title":"Sunday Classics 周日古典","date":"2026-06-07","parts":["足本 Full (HKT 20:05 - 22:00)","第一部份 Part 1 (HKT 20:05 - 21:00)","第二部份 Part 2 (HKT 21:05 - 22:00)"]},{"id":"1105119","title":"Sunday Classics 周日古典","date":"2026-05-31","parts":["足本 Full (HKT 20:05 - 22:00)","第一部份 Part 1 (HKT 20:05 - 21:00)","第二部份 Part 2 (HKT 21:05 - 22:00)"]},{"id":"1103789","title":"Sunday Classics 周日古典","date":"2026-05-24","parts":["足本 Full (HKT 20:05 - 22:00)","第一部份 Part 1 (HKT 20:05 - 21:00)","第二部份 Part 2 (HKT 21:05 - 22:00)"]},{"id":"1102363","title":"Sunday Classics 周日古典","date":"2026-05-17","parts":["足本 Full (HKT 20:05 - 22:00)","第一部份 Part 1 (HKT 20:05 - 21:00)","第二部份 Part 2 (HKT 21:05 - 22:00)"]},{"id":"1097780","title":"Sunday Classics 周日古典","date":"2026-05-10","parts":["足本 Full (HKT 20:05 - 22:00)","第一部份 Part 1 (HKT 20:05 - 21:00)","第二部份 Part 2 (HKT 21:05 - 22:00)"]},{"id":"1096355","title":"Sunday Classics 周日古典","date":"2026-05-03","parts":["足本 Full (HKT 20:05 - 22:00)","第一部份 Part 1 (HKT 20:05 - 21:00)","第二部份 Part 2 (HKT 21:05 - 22:00)"]},{"id":"1095057","title":"Sunday Classics 周日古典","date":"2026-04-26","parts":["足本 Full (HKT 20:05 - 22:00)","第一部份 Part 1 (HKT 20:05 - 21:00)","第二部份 Part 2 (HKT 21:05 - 22:00)"]},{"id":"1092985","title":"Sunday Classics 周日古典","date":"2026-04-19","parts":["足本 Full (HKT 20:05 - 22:00)","第一部份 Part 1 (HKT 20:05 - 21:00)","第二部份 Part 2 (HKT 21:05 - 22:00)"]},{"id":"1091547","title":"Sunday Classics 周日古典","date":"2026-04-12","parts":["足本 Full (HKT 20:05 - 22:00)","第一部份 Part 1 (HKT 20:05 - 21:00)","第二部份 Part 2 (HKT 21:05 - 22:00)"]},{"id":"1090291","title":"Sunday Classics 周日古典","date":"2026-04-05","parts":["足本 Full (HKT 20:05 - 22:00)","第一部份 Part 1 (HKT 20:05 - 21:00)","第二部份 Part 2 (HKT 21:05 - 22:00)"]},{"id":"1088859","title":"Sunday Classics 周日古典","date":"2026-03-29","parts":["足本 Full (HKT 20:05 - 22:00)","第一部份 Part 1 (HKT 20:05 - 21:00)","第二部份 Part 2 (HKT 21:05 - 22:00)"]},{"id":"1087347","title":"Sunday Classics 周日古典","date":"2026-03-22","parts":["足本 Full (HKT 20:05 - 22:00)","第一部份 Part 1 (HKT 20:05 - 21:00)","第二部份 Part 2 (HKT 21:05 - 22:00)"]},{"id":"1085965","title":"Sunday Classics 周日古典","date":"2026-03-15","parts":["足本 Full (HKT 20:05 - 22:00)","第一部份 Part 1 (HKT 20:05 - 21:00)","第二部份 Part 2 (HKT 21:05 - 22:00)"]},{"id":"1084524","title":"Sunday Classics 周日古典","date":"2026-03-08","parts":["足本 Full (HKT 20:05 - 22:00)","第一部份 Part 1 (HKT 20:05 - 21:00)","第二部份 Part 2 (HKT 21:05 - 22:00)"]},{"id":"1083001","title":"Sunday Classics 周日古典","date":"2026-03-01","parts":["足本 Full (HKT 20:05 - 22:00)","第一部份 Part 1 (HKT 20:05 - 21:00)","第二部份 Part 2 (HKT 21:05 - 22:00)"]},{"id":"1081712","title":"Sunday Classics 周日古典","date":"2026-02-22","parts":["足本 Full (HKT 20:05 - 22:00)","第一部份 Part 1 (HKT 20:05 - 21:00)","第二部份 Part 2 (HKT 21:05 - 22:00)"]},{"id":"1080574","title":"Sunday Classics 周日古典","date":"2026-02-15","parts":["足本 Full (HKT 20:05 - 22:00)","第一部份 Part 1 (HKT 20:05 - 21:00)","第二部份 Part 2 (HKT 21:05 - 22:00)"]},{"id":"1079099","title":"Sunday Classics 周日古典","date":"2026-02-08","parts":["足本 Full (HKT 20:05 - 22:00)","第一部份 Part 1 (HKT 20:05 - 21:00)","第二部份 Part 2 (HKT 21:05 - 22:00)"]},{"id":"1077669","title":"Sunday Classics 周日古典","date":"2026-02-01","parts":["足本 Full (HKT 20:05 - 22:00)","第一部份 Part 1 (HKT 20:05 - 21:00)","第二部份 Part 2 (HKT 21:05 - 22:00)"]},{"id":"1073769","title":"Sunday Classics 周日古典","date":"2026-01-18","parts":["足本 Full (HKT 20:05 - 22:00)","第一部份 Part 1 (HKT 20:05 - 21:00)","第二部份 Part 2 (HKT 21:05 - 22:00)"]},{"id":"1072291","title":"Sunday Classics 周日古典","date":"2026-01-11","parts":["足本 Full (HKT 20:05 - 22:00)","第一部份 Part 1 (HKT 20:05 - 21:00)","第二部份 Part 2 (HKT 21:05 - 22:00)"]},{"id":"1070517","title":"Sunday Classics 周日古典","date":"2026-01-04","parts":["足本 Full (HKT 20:05 - 22:00)","第一部份 Part 1 (HKT 20:05 - 21:00)","第二部份 Part 2 (HKT 21:05 - 22:00)"]},{"id":"1069120","title":"Sunday Classics 周日古典","date":"2025-12-28","parts":["足本 Full (HKT 20:05 - 22:00)","第一部份 Part 1 (HKT 20:05 - 21:00)","第二部份 Part 2 (HKT 21:05 - 22:00)"]},{"id":"1067919","title":"Sunday Classics 周日古典","date":"2025-12-21","parts":["足本 Full (HKT 20:05 - 22:00)","第一部份 Part 1 (HKT 20:05 - 21:00)","第二部份 Part 2 (HKT 21:05 - 22:00)"]},{"id":"1066478","title":"Sunday Classics 周日古典","date":"2025-12-14","parts":["足本 Full (HKT 20:05 - 22:00)","第一部份 Part 1 (HKT 20:05 - 21:00)","第二部份 Part 2 (HKT 21:05 - 22:00)"]},{"id":"1065104","title":"Sunday Classics 周日古典","date":"2025-12-07","parts":["足本 Full (HKT 20:05 - 22:00)","第一部份 Part 1 (HKT 20:05 - 21:00)","第二部份 Part 2 (HKT 21:05 - 22:00)"]},{"id":"1063597","title":"Sunday Classics 周日古典","date":"2025-11-30","parts":["足本 Full (HKT 20:05 - 22:00)","第一部份 Part 1 (HKT 20:05 - 21:00)","第二部份 Part 2 (HKT 21:05 - 22:00)"]},{"id":"1062074","title":"Sunday Classics 周日古典","date":"2025-11-23","parts":["足本 Full (HKT 20:05 - 22:00)","第一部份 Part 1 (HKT 20:05 - 21:00)","第二部份 Part 2 (HKT 21:05 - 22:00)"]},{"id":"1060513","title":"Sunday Classics 周日古典","date":"2025-11-16","parts":["足本 Full (HKT 20:05 - 22:00)","第一部份 Part 1 (HKT 20:05 - 21:00)","第二部份 Part 2 (HKT 21:05 - 22:00)"]},{"id":"1059029","title":"Sunday Classics 周日古典","date":"2025-11-09","parts":["足本 Full (HKT 20:05 - 22:00)","第一部份 Part 1 (HKT 20:05 - 21:00)","第二部份 Part 2 (HKT 21:05 - 22:00)"]},{"id":"1057487","title":"Sunday Classics 周日古典","date":"2025-11-02","parts":["足本 Full (HKT 20:05 - 22:00)","第一部份 Part 1 (HKT 20:05 - 21:00)","第二部份 Part 2 (HKT 21:05 - 22:00)"]},{"id":"1056079","title":"Sunday Classics 周日古典","date":"2025-10-26","parts":["足本 Full (HKT 20:05 - 22:00)","第一部份 Part 1 (HKT 20:05 - 21:00)","第二部份 Part 2 (HKT 21:05 - 22:00)"]},{"id":"1054639","title":"Sunday Classics 周日古典","date":"2025-10-19","parts":["足本 Full (HKT 20:05 - 22:00)","第一部份 Part 1 (HKT 20:05 - 21:00)","第二部份 Part 2 (HKT 21:05 - 22:00)"]},{"id":"1053192","title":"Sunday Classics 周日古典","date":"2025-10-12","parts":["足本 Full (HKT 20:05 - 22:00)","第一部份 Part 1 (HKT 20:05 - 21:00)","第二部份 Part 2 (HKT 21:05 - 22:00)"]},{"id":"1051863","title":"Sunday Classics 周日古典","date":"2025-10-05","parts":["足本 Full (HKT 20:05 - 22:00)","第一部份 Part 1 (HKT 20:05 - 21:00)","第二部份 Part 2 (HKT 21:05 - 22:00)"]}]}
