{"channel":"radio4","slug":"Cantilena","streamVersion":1,"episodes":[{"id":"1134164","title":"","date":"2026-10-17","parts":["足本 Full (HKT 18:10 - 20:00)","第一部份 Part 1 (HKT 18:10 - 19:00)","第二部份 Part 2 (HKT 19:05 - 20:00)"]},{"id":"1132799","title":"","date":"2026-10-10","parts":["足本 Full (HKT 18:10 - 20:00)","第一部份 Part 1 (HKT 18:10 - 19:00)","第二部份 Part 2 (HKT 19:05 - 20:00)"]},{"id":"1131380","title":"","date":"2026-10-03","parts":["足本 Full (HKT 18:10 - 20:00)","第一部份 Part 1 (HKT 18:10 - 19:00)","第二部份 Part 2 (HKT 19:05 - 20:00)"]},{"id":"1130029","title":"","date":"2026-09-26","parts":["足本 Full (HKT 18:10 - 20:00)","第一部份 Part 1 (HKT 18:10 - 19:00)","第二部份 Part 2 (HKT 19:05 - 20:00)"]},{"id":"1128352","title":"Cantilena 自投羅網 / Guests: Rachel Cheung, Linus Fung, Theresa Lam, Moon Hung and Sonia Lee","date":"2026-09-19","parts":["足本 Full (HKT 18:10 - 20:00)","第一部份 Part 1 (HKT 18:10 - 19:00)","第二部份 Part 2 (HKT 19:05 - 20:00)"]},{"id":"1126930","title":"Cantilena 自投羅網 / Guests: Cheng Wai, Colleen Lee, Raymond Young","date":"2026-09-12","parts":["足本 Full (HKT 18:10 - 20:00)","第一部份 Part 1 (HKT 18:10 - 19:00)","第二部份 Part 2 (HKT 19:05 - 20:00)"]},{"id":"1125405","title":"","date":"2026-09-05","parts":["足本 Full (HKT 18:10 - 20:00)","第一部份 Part 1 (HKT 18:10 - 19:00)","第二部份 Part 2 (HKT 19:05 - 20:00)"]},{"id":"1123970","title":"","date":"2026-08-29","parts":["足本 Full (HKT 18:10 - 20:00)","第一部份 Part 1 (HKT 18:10 - 19:00)","第二部份 Part 2 (HKT 19:05 - 20:00)"]},{"id":"1122597","title":"","date":"2026-08-22","parts":["足本 Full (HKT 18:10 - 20:00)","第一部份 Part 1 (HKT 18:10 - 19:00)","第二部份 Part 2 (HKT 19:05 - 20:00)"]},{"id":"1121175","title":"","date":"2026-08-15","parts":["足本 Full (HKT 18:10 - 20:00)","第一部份 Part 1 (HKT 18:10 - 19:00)","第二部份 Part 2 (HKT 19:05 - 20:00)"]},{"id":"1119784","title":"","date":"2026-08-08","parts":["足本 Full (HKT 18:10 - 20:00)","第一部份 Part 1 (HKT 18:10 - 19:00)","第二部份 Part 2 (HKT 19:05 - 20:00)"]},{"id":"1118302","title":"Cantilena 自投羅網 / Guest (by Phone): Jimmy Shiu","date":"2026-08-01","parts":["足本 Full (HKT 18:10 - 20:00)","第一部份 Part 1 (HKT 18:10 - 19:00)","第二部份 Part 2 (HKT 19:05 - 20:00)"]},{"id":"1116740","title":"","date":"2026-07-25","parts":["足本 Full (HKT 18:10 - 20:00)","第一部份 Part 1 (HKT 18:10 - 19:00)","第二部份 Part 2 (HKT 19:05 - 20:00)"]},{"id":"1115257","title":"","date":"2026-07-18","parts":["足本 Full (HKT 18:10 - 20:00)","第一部份 Part 1 (HKT 18:10 - 19:00)","第二部份 Part 2 (HKT 19:05 - 20:00)"]},{"id":"1113520","title":"Cantilena 自投羅網 / Guests: Luk Wai Chun, Ma Wai Him","date":"2026-07-11","parts":["足本 Full (HKT 18:10 - 20:00)","第一部份 Part 1 (HKT 18:10 - 19:00)","第二部份 Part 2 (HKT 19:05 - 20:00)"]},{"id":"1112016","title":"Cantilena 自投羅網 / Guest: NOĒMA","date":"2026-07-04","parts":["足本 Full (HKT 18:10 - 20:00)","第一部份 Part 1 (HKT 18:10 - 19:00)","第二部份 Part 2 (HKT 19:05 - 20:00)"]},{"id":"1110751","title":"Cantilena 自投羅網 / Guests: Dr. Chan Kai-young, Dr. Joyce Tang, Dr. Stephen Ng","date":"2026-06-27","parts":["足本 Full (HKT 18:10 - 20:00)","第一部份 Part 1 (HKT 18:10 - 19:00)","第二部份 Part 2 (HKT 19:05 - 20:00)"]},{"id":"1109266","title":"Cantilena 自投羅網 / Guest: Fiesta Brass","date":"2026-06-20","parts":["足本 Full (HKT 18:10 - 20:00)","第一部份 Part 1 (HKT 18:10 - 19:00)","第二部份 Part 2 (HKT 19:05 - 20:00)"]},{"id":"1106944","title":"Cantilena 自投羅網 / Guests: CONG Quartet, Rachel Cheung and CU Music Students","date":"2026-06-13","parts":["足本 Full (HKT 18:10 - 20:00)","第一部份 Part 1 (HKT 18:10 - 19:00)","第二部份 Part 2 (HKT 19:05 - 20:00)"]},{"id":"1106390","title":"Cantilena 自投羅網 / Guests: Prof Cheng Sealing and Prof Anna Shternshis","date":"2026-06-06","parts":["足本 Full (HKT 18:10 - 20:00)","第一部份 Part 1 (HKT 18:10 - 19:00)","第二部份 Part 2 (HKT 19:05 - 20:00)"]},{"id":"1104979","title":"","date":"2026-05-30","parts":["足本 Full (HKT 18:10 - 20:00)","第一部份 Part 1 (HKT 18:10 - 19:00)","第二部份 Part 2 (HKT 19:05 - 20:00)"]},{"id":"1103652","title":"Cantilena 自投羅網 / Guest: Dr Michael Mak","date":"2026-05-23","parts":["足本 Full (HKT 18:10 - 20:00)","第一部份 Part 1 (HKT 18:10 - 19:00)","第二部份 Part 2 (HKT 19:05 - 20:00)"]},{"id":"1102232","title":"Cantilena 自投羅網 / Guest: Nexus Ensemble","date":"2026-05-16","parts":["足本 Full (HKT 18:10 - 20:00)","第一部份 Part 1 (HKT 18:10 - 19:00)","第二部份 Part 2 (HKT 19:05 - 20:00)"]},{"id":"1097638","title":"Cantilena 自投羅網 / Guests: Aristo Sham and his mum, Colleen Lee and her mum","date":"2026-05-09","parts":["足本 Full (HKT 18:10 - 20:00)","第一部份 Part 1 (HKT 18:10 - 19:00)","第二部份 Part 2 (HKT 19:05 - 20:00)"]},{"id":"1096220","title":"Cantilena 自投羅網 / Guests: Angela Yau, Park Stickney, Sunshine Lo","date":"2026-05-02","parts":["足本 Full (HKT 18:10 - 20:00)","第一部份 Part 1 (HKT 18:10 - 19:00)","第二部份 Part 2 (HKT 19:05 - 20:00)"]},{"id":"1094925","title":"","date":"2026-04-25","parts":["足本 Full (HKT 18:10 - 20:00)","第一部份 Part 1 (HKT 18:10 - 19:00)","第二部份 Part 2 (HKT 19:05 - 20:00)"]},{"id":"1092852","title":"Cantilena 自投羅網 / Guest: Felix Tham","date":"2026-04-18","parts":["足本 Full (HKT 18:10 - 20:00)","第一部份 Part 1 (HKT 18:10 - 19:00)","第二部份 Part 2 (HKT 19:05 - 20:00)"]},{"id":"1091416","title":"Cantilena 自投羅網 / Guests: Peco Chui, Cedric Chan","date":"2026-04-11","parts":["足本 Full (HKT 18:10 - 20:00)","第一部份 Part 1 (HKT 18:10 - 19:00)","第二部份 Part 2 (HKT 19:05 - 20:00)"]},{"id":"1090176","title":"Cantilena 自投羅網 / 嘉賓：鍾志和","date":"2026-04-04","parts":["足本 Full (HKT 18:10 - 20:00)","第一部份 Part 1 (HKT 18:10 - 19:00)","第二部份 Part 2 (HKT 19:05 - 20:00)"]},{"id":"1088730","title":"Cantilena 自投羅網 / Guests: KaJeng Wong, Cheng Wai, Chang Tao","date":"2026-03-28","parts":["足本 Full (HKT 18:10 - 20:00)","第一部份 Part 1 (HKT 18:10 - 19:00)","第二部份 Part 2 (HKT 19:05 - 20:00)"]},{"id":"1087222","title":"","date":"2026-03-21","parts":["足本 Full (HKT 18:10 - 20:00)","第一部份 Part 1 (HKT 18:10 - 19:00)","第二部份 Part 2 (HKT 19:05 - 20:00)"]},{"id":"1085806","title":"","date":"2026-03-14","parts":["足本 Full (HKT 18:10 - 20:00)","第一部份 Part 1 (HKT 18:10 - 19:00)","第二部份 Part 2 (HKT 19:05 - 20:00)"]},{"id":"1084404","title":"Cantilena 自投羅網 / Guests: Yuki Ip, Mavis Lam, Sharon Choa, Cheung Pui Shan, Psyche Chui, Pansy Lai","date":"2026-03-07","parts":["足本 Full (HKT 18:10 - 20:00)","第一部份 Part 1 (HKT 18:10 - 19:00)","第二部份 Part 2 (HKT 19:05 - 20:00)"]},{"id":"1082842","title":"Cantilena 自投羅網 / Guest: Dr. Cheng Wai","date":"2026-02-28","parts":["足本 Full (HKT 18:10 - 20:00)","第一部份 Part 1 (HKT 18:10 - 19:00)","第二部份 Part 2 (HKT 19:05 - 20:00)"]},{"id":"1081582","title":"Cantilena 自投羅網 / Guests: HKAPA Chinese Music Players","date":"2026-02-21","parts":["足本 Full (HKT 18:10 - 20:00)","第一部份 Part 1 (HKT 18:10 - 19:00)","第二部份 Part 2 (HKT 19:05 - 20:00)"]},{"id":"1080445","title":"Cantilena 自投羅網 / Guests: Jacky Lau and his wife","date":"2026-02-14","parts":["足本 Full (HKT 18:10 - 20:00)","第一部份 Part 1 (HKT 18:10 - 19:00)","第二部份 Part 2 (HKT 19:05 - 20:00)"]},{"id":"1078946","title":"Cantilena 自投羅網 / 嘉賓: 聖公會林護紀念中學舊生合唱團","date":"2026-02-07","parts":["足本 Full (HKT 18:10 - 20:00)","第一部份 Part 1 (HKT 18:10 - 19:00)","第二部份 Part 2 (HKT 19:05 - 20:00)"]},{"id":"1077499","title":"","date":"2026-01-31","parts":["足本 Full (HKT 18:10 - 20:00)","第一部份 Part 1 (HKT 18:10 - 19:00)","第二部份 Part 2 (HKT 19:05 - 20:00)"]},{"id":"1076146","title":"","date":"2026-01-24","parts":["足本 Full (HKT 18:10 - 20:00)","第一部份 Part 1 (HKT 18:10 - 19:00)","第二部份 Part 2 (HKT 19:05 - 20:00)"]},{"id":"1073619","title":"Cantilena 自投羅網 / Guests: Ernestina Leung, Johnny Pun","date":"2026-01-17","parts":["足本 Full (HKT 18:10 - 20:00)","第一部份 Part 1 (HKT 18:10 - 19:00)","第二部份 Part 2 (HKT 19:05 - 20:00)"]},{"id":"1072165","title":"Cantilena 自投羅網 / Guest: Pierre Tang","date":"2026-01-10","parts":["足本 Full (HKT 18:10 - 20:00)","第一部份 Part 1 (HKT 18:10 - 19:00)","第二部份 Part 2 (HKT 19:05 - 20:00)"]},{"id":"1070378","title":"Cantilena 自投羅網 / Guests: Rachel Cheung, Raymond Young","date":"2026-01-03","parts":["足本 Full (HKT 18:10 - 20:00)","第一部份 Part 1 (HKT 18:10 - 19:00)","第二部份 Part 2 (HKT 19:05 - 20:00)"]},{"id":"1069002","title":"Cantilena 自投羅網 / Guests: Conductors and Accompanist","date":"2025-12-27","parts":["足本 Full (HKT 18:10 - 20:00)","第一部份 Part 1 (HKT 18:10 - 19:00)","第二部份 Part 2 (HKT 19:05 - 20:00)"]},{"id":"1065299","title":"","date":"2025-12-20","parts":["足本 Full (HKT 18:10 - 20:00)","第一部份 Part 1 (HKT 18:10 - 19:00)","第二部份 Part 2 (HKT 19:05 - 20:00)"]},{"id":"1065298","title":"","date":"2025-12-13","parts":["足本 Full (HKT 18:10 - 20:00)","第一部份 Part 1 (HKT 18:10 - 19:00)","第二部份 Part 2 (HKT 19:05 - 20:00)"]},{"id":"1064935","title":"Cantilena 自投羅網 / Guests: Angus Lee, Janice Zhou, 曾文通","date":"2025-12-06","parts":["足本 Full (HKT 18:10 - 20:00)","第一部份 Part 1 (HKT 18:10 - 19:00)","第二部份 Part 2 (HKT 19:05 - 20:00)"]},{"id":"1063424","title":"Cantilena 自投羅網 / Guest: HKDuo","date":"2025-11-29","parts":["足本 Full (HKT 18:10 - 20:00)","第一部份 Part 1 (HKT 18:10 - 19:00)","第二部份 Part 2 (HKT 19:05 - 20:00)"]},{"id":"1061560","title":"Cantilena 自投羅網 / Guest: William Ting","date":"2025-11-22","parts":["足本 Full (HKT 18:10 - 20:00)","第一部份 Part 1 (HKT 18:10 - 19:00)","第二部份 Part 2 (HKT 19:05 - 20:00)"]},{"id":"1060373","title":"Cantilena 自投羅網 / Guests: Harmonica Players","date":"2025-11-15","parts":["足本 Full (HKT 18:10 - 20:00)","第一部份 Part 1 (HKT 18:10 - 19:00)","第二部份 Part 2 (HKT 19:05 - 20:00)"]},{"id":"1058444","title":"Cantilena 自投羅網 / Guests: Nina Yip, Yuki Ip, Margaret Yim, Jovita Leung, Ashley Tsui, Bobbie Zhang, David Quah","date":"2025-11-08","parts":["足本 Full (HKT 18:10 - 20:00)","第一部份 Part 1 (HKT 18:10 - 19:00)","第二部份 Part 2 (HKT 19:05 - 20:00)"]},{"id":"1056932","title":"Cantilena 自投羅網 / Guests: Dominic Lam, Jason Liu","date":"2025-11-01","parts":["足本 Full (HKT 18:10 - 20:00)","第一部份 Part 1 (HKT 18:10 - 19:00)","第二部份 Part 2 (HKT 19:05 - 20:00)"]}]}
