{"channel":"radio1","slug":"always_by_your_side","streamVersion":1,"episodes":[{"id":"1133393","title":"我們一直都在說故事《當更72小時之相聚半刻》","date":"2026-10-17","parts":["足本 Full (HKT 21:04 - 22:00)"]},{"id":"1132481","title":"我們一直都在說故事《當更72小時之想太多》","date":"2026-10-10","parts":["足本 Full (HKT 21:00 - 22:00)"]},{"id":"1131338","title":"我們一直都在說故事《當更72小時之快樂時要快樂》","date":"2026-10-03","parts":["足本 Full (HKT 21:00 - 22:00)"]},{"id":"1129864","title":"我們一直都在說故事《當更72小時之騎楊搵牛》","date":"2026-09-26","parts":["足本 Full (HKT 21:00 - 22:00)"]},{"id":"1128291","title":"我們一直都在說故事《當更72小時之暮年回首(下)》","date":"2026-09-19","parts":["足本 Full (HKT 21:00 - 22:00)"]},{"id":"1126811","title":"我們一直都在說故事《當更72小時之暮年回首(上)》","date":"2026-09-12","parts":["足本 Full (HKT 21:00 - 22:00)"]},{"id":"1125259","title":"我們一直都在說故事《當更72小時之因為寂寞(下)》","date":"2026-09-05","parts":["足本 Full (HKT 21:00 - 22:00)"]},{"id":"1123940","title":"我們一直都在說故事《當更72小時之因為寂寞(上)》","date":"2026-08-29","parts":["足本 Full (HKT 21:00 - 22:00)"]},{"id":"1122568","title":"我們一直都在說故事《當更72小時之環保回收的愛情(下)》","date":"2026-08-22","parts":["足本 Full (HKT 21:00 - 22:00)"]},{"id":"1121053","title":"我們一直都在說故事《當更72小時之環保回收的愛情(中)》","date":"2026-08-15","parts":["足本 Full (HKT 21:00 - 22:00)"]},{"id":"1119756","title":"我們一直都在說故事《當更72小時之環保回收的愛情(上)》","date":"2026-08-08","parts":["足本 Full (HKT 21:00 - 22:00)"]},{"id":"1118270","title":"我們一直都在說故事《當更72小時之為他人作洗衣裳(下)》","date":"2026-08-01","parts":["足本 Full (HKT 21:00 - 22:00)"]},{"id":"1116712","title":"我們一直都在說故事《當更72小時之為他人作洗衣裳(上)》","date":"2026-07-25","parts":["足本 Full (HKT 21:00 - 22:00)"]},{"id":"1112894","title":"我們一直都在說故事《當更72小時之頌缽的聲音(下)》","date":"2026-07-18","parts":["足本 Full (HKT 21:00 - 22:00)"]},{"id":"1112892","title":"我們一直都在說故事《當更72小時之頌缽的聲音(上)》","date":"2026-07-11","parts":["足本 Full (HKT 21:00 - 22:00)"]},{"id":"1111975","title":"我們一直都在說故事《當更72小時之香燭店奇遇記(下)》","date":"2026-07-04","parts":["足本 Full (HKT 21:00 - 22:00)"]},{"id":"1110624","title":"我們一直都在說故事《當更72小時之香燭店奇遇記(上)》","date":"2026-06-27","parts":["足本 Full (HKT 21:00 - 22:00)"]},{"id":"1109192","title":"我們一直都在說故事《當更72小時之飲宴奇遇記》","date":"2026-06-20","parts":["足本 Full (HKT 21:00 - 22:00)"]},{"id":"1107742","title":"我們一直都在說故事《當更72小時之泰菜風雲(下)》","date":"2026-06-13","parts":["足本 Full (HKT 21:00 - 22:00)"]},{"id":"1106361","title":"我們一直都在說故事《當更72小時之泰菜風雲(上)》","date":"2026-06-06","parts":["足本 Full (HKT 21:00 - 22:00)"]},{"id":"1104950","title":"我們一直都在說故事《當更72小時之紙紮的愛》","date":"2026-05-30","parts":["足本 Full (HKT 21:00 - 22:00)"]},{"id":"1103626","title":"我們一直都在說故事《當更72小時之香燭店奇異事件簿》","date":"2026-05-23","parts":["足本 Full (HKT 21:00 - 22:00)"]},{"id":"1102205","title":"我們一直都在說故事《當更72小時之空巢老貓 (下）》","date":"2026-05-16","parts":["足本 Full (HKT 21:00 - 22:00)"]},{"id":"1097598","title":"我們一直都在說故事《當更72小時之空巢老貓 (上）》","date":"2026-05-09","parts":["足本 Full (HKT 21:00 - 22:00)"]},{"id":"1096030","title":"我們一直都在說故事《如是素食店》第七集：如是第315日:不是「營造」的人情味","date":"2026-05-02","parts":["足本 Full (HKT 21:00 - 22:00)"]},{"id":"1094431","title":"我們一直都在說故事《屏下餘溫》第三集 (完結篇)","date":"2026-04-25","parts":["足本 Full (HKT 21:00 - 22:00)"]},{"id":"1092808","title":"我們一直都在說故事《屏下餘溫》第二集","date":"2026-04-18","parts":["足本 Full (HKT 21:00 - 22:00)"]},{"id":"1091332","title":"我們一直都在說故事《屏下餘溫》第一集","date":"2026-04-11","parts":["足本 Full (HKT 21:00 - 22:00)"]},{"id":"1090148","title":"我們一直都在說故事《如是素食店》第六集：如是第280日:算不出的『人情味』","date":"2026-04-04","parts":["足本 Full (HKT 21:00 - 22:00)"]},{"id":"1088429","title":"我們一直都在說故事《如是素食店》第五集：如是第245日:五味雜陳的成長","date":"2026-03-28","parts":["足本 Full (HKT 21:00 - 22:00)"]},{"id":"1087193","title":"我們一直都在說故事《五號碼頭》單元劇","date":"2026-03-21","parts":["足本 Full (HKT 21:00 - 22:00)"]},{"id":"1085036","title":"我們一直都在說故事《通宵巴士》單元劇","date":"2026-03-14","parts":["足本 Full (HKT 21:00 - 22:00)"]},{"id":"1083895","title":"我們一直都在說故事《歲月的底片》第四集 (結局篇)","date":"2026-03-07","parts":["足本 Full (HKT 21:00 - 22:00)"]},{"id":"1081437","title":"我們一直都在說故事《歲月的底片》第三集","date":"2026-02-28","parts":["足本 Full (HKT 21:00 - 22:00)"]},{"id":"1080933","title":"我們一直都在說故事《歲月的底片》第二集","date":"2026-02-21","parts":["足本 Full (HKT 21:00 - 22:00)"]},{"id":"1080052","title":"我們一直都在說故事《歲月的底片》第一集","date":"2026-02-14","parts":["足本 Full (HKT 21:00 - 22:00)"]},{"id":"1078615","title":"我們一直都在說故事《如是素食店》第四集：如是第188日:回憶的味道","date":"2026-02-07","parts":["足本 Full (HKT 21:00 - 22:00)"]},{"id":"1077457","title":"我們一直都在說故事《如是素食店》第三集：如是第87日:蘿蔔青菜，各有所愛？","date":"2026-01-31","parts":["足本 Full (HKT 21:00 - 22:00)"]},{"id":"1075850","title":"我們一直都在說故事《如是素食店》第二集：如是第31日:酸甜苦辣，無可不可","date":"2026-01-24","parts":["足本 Full (HKT 21:00 - 22:00)"]},{"id":"1073502","title":"我們一直都在說故事《如是素食店》第一集：如是第0日:歸零，重新出發","date":"2026-01-17","parts":["足本 Full (HKT 21:00 - 22:00)"]},{"id":"1071435","title":"我們一直都在說故事《龍歸故里》第四季","date":"2026-01-10","parts":["足本 Full (HKT 21:00 - 22:00)"]},{"id":"1070398","title":"我們一直都在說故事《龍歸故里》第三季","date":"2026-01-03","parts":["足本 Full (HKT 21:00 - 22:00)"]},{"id":"1070820","title":"我們一直都在說故事《龍歸故里》第二季","date":"2025-12-27","parts":["足本 Full (HKT 21:00 - 22:00)"]},{"id":"1067657","title":"我們一直都在說故事《龍歸故里》第一季","date":"2025-12-20","parts":["足本 Full (HKT 21:00 - 22:00)"]},{"id":"1066177","title":"我們一直都在說故事《織織復織織》第三集","date":"2025-12-13","parts":["足本 Full (HKT 21:00 - 22:00)"]},{"id":"1064903","title":"我們一直都在說故事《織織復織織》第二集","date":"2025-12-06","parts":["足本 Full (HKT 21:00 - 22:00)"]},{"id":"1063393","title":"我們一直都在說故事《織織復織織》第一集","date":"2025-11-29","parts":["足本 Full (HKT 21:00 - 22:00)"]},{"id":"1061100","title":"我們一直都在說故事《診所最後的一天》單元劇","date":"2025-11-22","parts":["足本 Full (HKT 21:00 - 22:00)"]},{"id":"1060333","title":"我們一直都在說故事《雪莉屋》單元劇","date":"2025-11-15","parts":["足本 Full (HKT 21:00 - 22:00)"]},{"id":"1058757","title":"我們一直都在說故事《堅持劍擊路》第二集","date":"2025-11-08","parts":["足本 Full (HKT 21:00 - 22:00)"]},{"id":"1057320","title":"我們一直都在說故事《堅持劍擊路》第一集","date":"2025-11-01","parts":["足本 Full (HKT 21:00 - 22:00)"]}]}
