{"channel":"radio3","slug":"holiday_sunset_show","streamVersion":1,"episodes":[{"id":"1134412","title":"","date":"2026-10-19","parts":["足本 Full (HKT 17:05 - 21:00)","第一部份 Part 1 (HKT 17:05 - 18:00)","第二部份 Part 2 (HKT 18:10 - 19:00)","第三部份 Part 3 (HKT 19:05 - 20:00)","第四部份 Part 4 (HKT 20:05 - 21:00)"]},{"id":"1130987","title":"","date":"2026-10-01","parts":["足本 Full (HKT 17:05 - 21:00)","第一部份 Part 1 (HKT 17:05 - 18:00)","第二部份 Part 2 (HKT 18:10 - 19:00)","第三部份 Part 3 (HKT 19:05 - 20:00)","第四部份 Part 4 (HKT 20:05 - 21:00)"]},{"id":"1111406","title":"","date":"2026-07-01","parts":["足本 Full (HKT 17:05 - 21:00)","第一部份 Part 1 (HKT 17:05 - 18:00)","第二部份 Part 2 (HKT 18:10 - 19:00)","第三部份 Part 3 (HKT 19:05 - 20:00)","第四部份 Part 4 (HKT 20:05 - 21:00)"]},{"id":"1109136","title":"","date":"2026-06-19","parts":["足本 Full (HKT 17:05 - 21:00)","第一部份 Part 1 (HKT 17:05 - 18:00)","第二部份 Part 2 (HKT 18:10 - 19:00)","第三部份 Part 3 (HKT 19:05 - 20:00)","第四部份 Part 4 (HKT 20:05 - 21:00)"]},{"id":"1103910","title":"","date":"2026-05-25","parts":["足本 Full (HKT 17:05 - 21:00)","第一部份 Part 1 (HKT 17:05 - 18:00)","第二部份 Part 2 (HKT 18:10 - 19:00)","第三部份 Part 3 (HKT 19:05 - 20:00)","第四部份 Part 4 (HKT 20:05 - 21:00)"]},{"id":"1096092","title":"","date":"2026-05-01","parts":["足本 Full (HKT 17:05 - 21:00)","第一部份 Part 1 (HKT 17:05 - 18:00)","第二部份 Part 2 (HKT 18:10 - 19:00)","第三部份 Part 3 (HKT 19:05 - 20:00)","第四部份 Part 4 (HKT 20:05 - 21:00)"]},{"id":"1090541","title":"","date":"2026-04-07","parts":["足本 Full (HKT 17:05 - 21:00)","第一部份 Part 1 (HKT 17:05 - 18:00)","第二部份 Part 2 (HKT 18:10 - 19:00)","第三部份 Part 3 (HKT 19:05 - 20:00)","第四部份 Part 4 (HKT 20:05 - 21:00)"]},{"id":"1090399","title":"","date":"2026-04-06","parts":["足本 Full (HKT 17:05 - 21:00)","第一部份 Part 1 (HKT 17:05 - 18:00)","第二部份 Part 2 (HKT 18:10 - 19:00)","第三部份 Part 3 (HKT 19:05 - 20:00)","第四部份 Part 4 (HKT 20:05 - 21:00)"]},{"id":"1090021","title":"","date":"2026-04-03","parts":["足本 Full (HKT 17:05 - 21:00)","第一部份 Part 1 (HKT 17:05 - 18:00)","第二部份 Part 2 (HKT 18:10 - 19:00)","第三部份 Part 3 (HKT 19:05 - 20:00)","第四部份 Part 4 (HKT 20:05 - 21:00)"]},{"id":"1081244","title":"","date":"2026-02-19","parts":["足本 Full (HKT 17:05 - 21:00)","第一部份 Part 1 (HKT 17:05 - 18:00)","第二部份 Part 2 (HKT 18:10 - 19:00)","第三部份 Part 3 (HKT 19:05 - 20:00)","第四部份 Part 4 (HKT 20:05 - 21:00)"]},{"id":"1081102","title":"","date":"2026-02-18","parts":["足本 Full (HKT 17:05 - 21:00)","第一部份 Part 1 (HKT 17:05 - 18:00)","第二部份 Part 2 (HKT 18:10 - 19:00)","第三部份 Part 3 (HKT 19:05 - 20:00)","第四部份 Part 4 (HKT 20:05 - 21:00)"]},{"id":"1080969","title":"","date":"2026-02-17","parts":["足本 Full (HKT 17:05 - 21:00)","第一部份 Part 1 (HKT 17:05 - 18:00)","第二部份 Part 2 (HKT 18:10 - 19:00)","第三部份 Part 3 (HKT 19:05 - 20:00)","第四部份 Part 4 (HKT 20:05 - 21:00)"]},{"id":"1070012","title":"","date":"2026-01-01","parts":["足本 Full (HKT 17:05 - 21:00)","第一部份 Part 1 (HKT 17:05 - 18:00)","第二部份 Part 2 (HKT 18:10 - 19:00)","第三部份 Part 3 (HKT 19:05 - 20:00)","第四部份 Part 4 (HKT 20:05 - 21:00)"]},{"id":"1068873","title":"","date":"2025-12-26","parts":["足本 Full (HKT 17:05 - 21:00)","第一部份 Part 1 (HKT 17:05 - 18:00)","第二部份 Part 2 (HKT 18:10 - 19:00)","第三部份 Part 3 (HKT 19:05 - 20:00)","第四部份 Part 4 (HKT 20:05 - 21:00)"]},{"id":"1068734","title":"","date":"2025-12-25","parts":["足本 Full (HKT 17:05 - 21:00)","第一部份 Part 1 (HKT 17:05 - 18:00)","第二部份 Part 2 (HKT 18:10 - 19:00)","第三部份 Part 3 (HKT 19:05 - 20:00)","第四部份 Part 4 (HKT 20:05 - 21:00)"]}]}
