{"channel":"pth","slug":"p2376_hongkongers_run","streamVersion":1,"episodes":[{"id":"1124761","title":"第十一集：第十一堂 - 從香港跑向世界","date":"2026-09-12","parts":["足本 Full (HKT 22:05 - 23:00)"]},{"id":"1124760","title":"第十集：第十堂 - 「香港特色 - 毅⾏者！」","date":"2026-09-05","parts":["足本 Full (HKT 22:05 - 23:00)"]},{"id":"1110115","title":"第九集：第九堂 – 香港式的⾺拉松","date":"2026-08-29","parts":["足本 Full (HKT 22:05 - 23:00)"]},{"id":"1110114","title":"第八集：第八堂 – 遠離煩「Hill」！","date":"2026-08-22","parts":["足本 Full (HKT 22:05 - 23:00)"]},{"id":"1110113","title":"第七集：第七堂 – 跑步如何變得快？自我肌⼒訓練","date":"2026-08-15","parts":["足本 Full (HKT 22:05 - 23:00)"]},{"id":"1110112","title":"第六集：第六堂 – 跑步變得科學化","date":"2026-08-08","parts":["足本 Full (HKT 22:05 - 23:00)"]},{"id":"1110111","title":"第五集：第五堂 – 跑步有裝備101","date":"2026-08-01","parts":["足本 Full (HKT 22:05 - 23:00)"]},{"id":"1110110","title":"第四集：第四堂 - 自己跑，變一齊跑！團跑⽂化！","date":"2026-07-25","parts":["足本 Full (HKT 22:05 - 23:00)"]},{"id":"1110109","title":"第三集：第三堂 - 人到中年好跑得！","date":"2026-07-18","parts":["足本 Full (HKT 22:05 - 23:00)"]},{"id":"1110107","title":"第二集：第二堂 - 從跑步，到跑手","date":"2026-07-11","parts":["足本 Full (HKT 22:05 - 23:00)"]},{"id":"1110105","title":"第一集：第一堂 - 跑出零變一！","date":"2026-07-04","parts":["足本 Full (HKT 22:05 - 23:00)"]}]}
