{"channel":"pth","slug":"p2334_next_stop","streamVersion":1,"episodes":[{"id":"1108196","title":"Episode 12: Chatterton Isabelle Genevieve – Half American Half Russian","date":"2026-09-19","parts":["足本 Full (HKT 21:05 - 22:00)"]},{"id":"1108195","title":"Episode 11: Alberts Kirsons – Latvia","date":"2026-09-12","parts":["足本 Full (HKT 21:05 - 22:00)"]},{"id":"1108194","title":"Episode 10: Uros Poleksic – Serbia","date":"2026-09-05","parts":["足本 Full (HKT 21:05 - 22:00)"]},{"id":"1108192","title":"Episode 9: Yoon Akari – Myanmar","date":"2026-08-29","parts":["足本 Full (HKT 21:05 - 22:00)"]},{"id":"1108191","title":"Episode 8: Chelin Celine Seo – Half Korean Half Indonesian","date":"2026-08-22","parts":["足本 Full (HKT 21:05 - 22:00)"]},{"id":"1108190","title":"Episode 7: Abdullah Noor Khan – Pakistan","date":"2026-08-15","parts":["足本 Full (HKT 21:05 - 22:00)"]},{"id":"1108189","title":"Episode 6: Nandin-Erdene Javkhlan – Mongolia","date":"2026-08-08","parts":["足本 Full (HKT 21:05 - 22:00)"]},{"id":"1108188","title":"Episode 5: Deniz Koçak – Turkey","date":"2026-08-01","parts":["足本 Full (HKT 21:05 - 22:00)"]},{"id":"1108187","title":"Episode 4: Yerken Bernar – Kazakhstan","date":"2026-07-25","parts":["足本 Full (HKT 21:05 - 22:00)"]},{"id":"1108186","title":"Episode 3: MD Fahim Newaz – Bangladesh","date":"2026-07-18","parts":["足本 Full (HKT 21:05 - 22:00)"]},{"id":"1108185","title":"Episode 2: Stella Yap – Malaysia","date":"2026-07-11","parts":["足本 Full (HKT 21:05 - 22:00)"]},{"id":"1108184","title":"Episode 1: Paolo Palanisamy – Philippines","date":"2026-07-04","parts":["足本 Full (HKT 21:05 - 22:00)"]}]}
