{"channel":"radio2","slug":"intlpopchart","streamVersion":1,"episodes":[{"id":"1135319","title":"24/10/2026-30/10/2026","date":"2026-10-24","parts":["足本 Full (HKT 18:04 - 20:00)","第一部份 Part 1 (HKT 18:04 - 19:00)","第二部份 Part 2 (HKT 19:04 - 20:00)"]},{"id":"1134125","title":"17/10/2026-23/10/2026","date":"2026-10-17","parts":["足本 Full (HKT 18:00 - 20:00)","第一部份 Part 1 (HKT 18:04 - 19:00)","第二部份 Part 2 (HKT 19:04 - 20:00)"]},{"id":"1132723","title":"10/10/2026-16/10/2026","date":"2026-10-10","parts":["足本 Full (HKT 18:00 - 20:00)","第一部份 Part 1 (HKT 18:04 - 19:00)","第二部份 Part 2 (HKT 19:04 - 20:00)"]},{"id":"1131360","title":"3/10/2026-9/10/2026","date":"2026-10-03","parts":["足本 Full (HKT 18:00 - 20:00)","第一部份 Part 1 (HKT 18:04 - 19:00)","第二部份 Part 2 (HKT 19:04 - 20:00)"]},{"id":"1129970","title":"26/9/2026-2/10/2026","date":"2026-09-26","parts":["足本 Full (HKT 18:00 - 20:00)","第一部份 Part 1 (HKT 18:04 - 19:00)","第二部份 Part 2 (HKT 19:04 - 20:00)"]},{"id":"1128334","title":"19/9/2026-25/9/2026","date":"2026-09-19","parts":["足本 Full (HKT 18:00 - 20:00)","第一部份 Part 1 (HKT 18:04 - 19:00)","第二部份 Part 2 (HKT 19:04 - 20:00)"]},{"id":"1126892","title":"12/9/2026-18/9/2026","date":"2026-09-12","parts":["足本 Full (HKT 18:00 - 20:00)","第一部份 Part 1 (HKT 18:04 - 19:00)","第二部份 Part 2 (HKT 19:04 - 20:00)"]},{"id":"1125363","title":"5/9/2026-11/9/2026","date":"2026-09-05","parts":["足本 Full (HKT 18:00 - 20:00)","第一部份 Part 1 (HKT 18:04 - 19:00)","第二部份 Part 2 (HKT 19:04 - 20:00)"]},{"id":"1123951","title":"29/8/2026-4/9/2026","date":"2026-08-29","parts":["足本 Full (HKT 18:00 - 20:00)","第一部份 Part 1 (HKT 18:04 - 19:00)","第二部份 Part 2 (HKT 19:04 - 20:00)"]},{"id":"1122579","title":"22/8/2026-28/8/2026","date":"2026-08-22","parts":["足本 Full (HKT 18:00 - 20:00)","第一部份 Part 1 (HKT 18:04 - 19:00)","第二部份 Part 2 (HKT 19:04 - 20:00)"]},{"id":"1121156","title":"15/8/2026-21/8/2026","date":"2026-08-15","parts":["足本 Full (HKT 18:00 - 20:00)","第一部份 Part 1 (HKT 18:04 - 19:00)","第二部份 Part 2 (HKT 19:04 - 20:00)"]},{"id":"1119668","title":"8/8/2026-14/8/2026","date":"2026-08-08","parts":["足本 Full (HKT 18:00 - 20:00)","第一部份 Part 1 (HKT 18:04 - 19:00)","第二部份 Part 2 (HKT 19:04 - 20:00)"]},{"id":"1118281","title":"1/8/2026-7/8/2026","date":"2026-08-01","parts":["足本 Full (HKT 18:00 - 20:00)","第一部份 Part 1 (HKT 18:04 - 19:00)","第二部份 Part 2 (HKT 19:04 - 20:00)"]},{"id":"1116368","title":"25/7/2026-31/7/2026","date":"2026-07-25","parts":["足本 Full (HKT 18:00 - 20:00)","第一部份 Part 1 (HKT 18:04 - 19:00)","第二部份 Part 2 (HKT 19:04 - 20:00)"]},{"id":"1115021","title":"18/7/2026-24/7/2026","date":"2026-07-18","parts":["足本 Full (HKT 18:00 - 20:00)","第一部份 Part 1 (HKT 18:04 - 19:00)","第二部份 Part 2 (HKT 19:04 - 20:00)"]},{"id":"1113500","title":"11/7/2026-17/7/2026","date":"2026-07-11","parts":["足本 Full (HKT 18:00 - 20:00)","第一部份 Part 1 (HKT 18:04 - 19:00)","第二部份 Part 2 (HKT 19:04 - 20:00)"]},{"id":"1111930","title":"4/7/2026-10/7/2026","date":"2026-07-04","parts":["足本 Full (HKT 18:00 - 20:00)","第一部份 Part 1 (HKT 18:04 - 19:00)","第二部份 Part 2 (HKT 19:04 - 20:00)"]},{"id":"1110730","title":"27/6/2026-3/7/2026","date":"2026-06-27","parts":["足本 Full (HKT 18:00 - 20:00)","第一部份 Part 1 (HKT 18:04 - 19:00)","第二部份 Part 2 (HKT 19:04 - 20:00)"]},{"id":"1109221","title":"20/6/2026-26/6/2026","date":"2026-06-20","parts":["足本 Full (HKT 18:00 - 20:00)","第一部份 Part 1 (HKT 18:04 - 19:00)","第二部份 Part 2 (HKT 19:04 - 20:00)"]},{"id":"1107751","title":"13/6/2026-19/6/2026","date":"2026-06-13","parts":["足本 Full (HKT 18:00 - 20:00)","第一部份 Part 1 (HKT 18:04 - 19:00)","第二部份 Part 2 (HKT 19:04 - 20:00)"]},{"id":"1106371","title":"6/6/2026-12/6/2026","date":"2026-06-06","parts":["足本 Full (HKT 18:00 - 20:00)","第一部份 Part 1 (HKT 18:04 - 19:00)","第二部份 Part 2 (HKT 19:04 - 20:00)"]},{"id":"1104896","title":"30/5/2026-5/6/2026","date":"2026-05-30","parts":["足本 Full (HKT 18:00 - 20:00)","第一部份 Part 1 (HKT 18:04 - 19:00)","第二部份 Part 2 (HKT 19:04 - 20:00)"]},{"id":"1103611","title":"23/5/2026-29/5/2026","date":"2026-05-23","parts":["足本 Full (HKT 18:00 - 20:00)","第一部份 Part 1 (HKT 18:04 - 19:00)","第二部份 Part 2 (HKT 19:04 - 20:00)"]},{"id":"1102054","title":"16/5/2026-22/5/2026","date":"2026-05-16","parts":["足本 Full (HKT 18:00 - 20:00)","第一部份 Part 1 (HKT 18:04 - 19:00)","第二部份 Part 2 (HKT 19:04 - 20:00)"]},{"id":"1097619","title":"9/5/2026-15/5/2026","date":"2026-05-09","parts":["足本 Full (HKT 18:00 - 20:00)","第一部份 Part 1 (HKT 18:04 - 19:00)","第二部份 Part 2 (HKT 19:04 - 20:00)"]},{"id":"1096162","title":"2/5/2026-8/5/2026","date":"2026-05-02","parts":["足本 Full (HKT 18:00 - 20:00)","第一部份 Part 1 (HKT 18:04 - 19:00)","第二部份 Part 2 (HKT 19:04 - 20:00)"]},{"id":"1094906","title":"25/4/2026- 1/5/2026","date":"2026-04-25","parts":["足本 Full (HKT 18:00 - 20:00)","第一部份 Part 1 (HKT 18:04 - 19:00)","第二部份 Part 2 (HKT 19:04 - 20:00)"]},{"id":"1092455","title":"18/4/2026-24/4/2026","date":"2026-04-18","parts":["足本 Full (HKT 18:00 - 20:00)","第一部份 Part 1 (HKT 18:04 - 19:00)","第二部份 Part 2 (HKT 19:04 - 20:00)"]},{"id":"1091335","title":"11/4/2026-17/4/2026","date":"2026-04-11","parts":["足本 Full (HKT 18:00 - 20:00)","第一部份 Part 1 (HKT 18:04 - 19:00)","第二部份 Part 2 (HKT 19:04 - 20:00)"]},{"id":"1089888","title":"4/4/2026-10/4/2026","date":"2026-04-04","parts":["足本 Full (HKT 18:00 - 20:00)","第一部份 Part 1 (HKT 18:04 - 19:00)","第二部份 Part 2 (HKT 19:04 - 20:00)"]},{"id":"1088619","title":"28/3/2026-3/4/2026","date":"2026-03-28","parts":["足本 Full (HKT 18:00 - 20:00)","第一部份 Part 1 (HKT 18:04 - 19:00)","第二部份 Part 2 (HKT 19:04 - 20:00)"]},{"id":"1087097","title":"21/3/2026-27/3/2026","date":"2026-03-21","parts":["足本 Full (HKT 18:00 - 20:00)","第一部份 Part 1 (HKT 18:04 - 19:00)","第二部份 Part 2 (HKT 19:04 - 20:00)"]},{"id":"1085657","title":"14/3/2026-20/3/2026","date":"2026-03-14","parts":["足本 Full (HKT 18:00 - 20:00)","第一部份 Part 1 (HKT 18:04 - 19:00)","第二部份 Part 2 (HKT 19:04 - 20:00)"]},{"id":"1084384","title":"7/3/2026-13/3/2026","date":"2026-03-07","parts":["足本 Full (HKT 18:00 - 20:00)","第一部份 Part 1 (HKT 18:04 - 19:00)","第二部份 Part 2 (HKT 19:04 - 20:00)"]},{"id":"1082822","title":"28/2/2026-6/3/2026","date":"2026-02-28","parts":["足本 Full (HKT 18:00 - 20:00)","第一部份 Part 1 (HKT 18:04 - 19:00)","第二部份 Part 2 (HKT 19:04 - 20:00)"]},{"id":"1081493","title":"21/2/2026-27/2/2026","date":"2026-02-21","parts":["足本 Full (HKT 18:00 - 20:00)","第一部份 Part 1 (HKT 18:04 - 19:00)","第二部份 Part 2 (HKT 19:04 - 20:00)"]},{"id":"1080291","title":"14/2/2026-20/2/2026","date":"2026-02-14","parts":["足本 Full (HKT 18:00 - 20:00)","第一部份 Part 1 (HKT 18:04 - 19:00)","第二部份 Part 2 (HKT 19:04 - 20:00)"]},{"id":"1078634","title":"7/2/2026-13/2/2026","date":"2026-02-07","parts":["足本 Full (HKT 18:00 - 20:00)","第一部份 Part 1 (HKT 18:04 - 19:00)","第二部份 Part 2 (HKT 19:04 - 20:00)"]},{"id":"1077405","title":"31/1/2026-6/2/2026","date":"2026-01-31","parts":["足本 Full (HKT 18:00 - 20:00)","第一部份 Part 1 (HKT 18:04 - 19:00)","第二部份 Part 2 (HKT 19:04 - 20:00)"]},{"id":"1076126","title":"24/1/2026-30/1/2026","date":"2026-01-24","parts":["足本 Full (HKT 18:00 - 20:00)","第一部份 Part 1 (HKT 18:04 - 19:00)","第二部份 Part 2 (HKT 19:04 - 20:00)"]},{"id":"1073485","title":"17/1/2026-23/1/2026","date":"2026-01-17","parts":["足本 Full (HKT 18:00 - 20:00)","第一部份 Part 1 (HKT 18:04 - 19:00)","第二部份 Part 2 (HKT 19:04 - 20:00)"]},{"id":"1072066","title":"10/1/2026-16/1/2026","date":"2026-01-10","parts":["足本 Full (HKT 18:00 - 20:00)","第一部份 Part 1 (HKT 18:04 - 19:00)","第二部份 Part 2 (HKT 19:04 - 20:00)"]},{"id":"1070222","title":"3/1/2026-9/1/2026","date":"2026-01-03","parts":["足本 Full (HKT 18:00 - 20:00)","第一部份 Part 1 (HKT 18:04 - 19:00)","第二部份 Part 2 (HKT 19:04 - 20:00)"]},{"id":"1068647","title":"27/12/2025-2/1/2026","date":"2025-12-27","parts":["足本 Full (HKT 18:00 - 20:00)","第一部份 Part 1 (HKT 18:04 - 19:00)","第二部份 Part 2 (HKT 19:04 - 20:00)"]},{"id":"1067672","title":"20/12/2025-26/12/2025","date":"2025-12-20","parts":["足本 Full (HKT 18:00 - 20:00)","第一部份 Part 1 (HKT 18:04 - 19:00)","第二部份 Part 2 (HKT 19:04 - 20:00)"]},{"id":"1066152","title":"13/12/2025-19/12/2025","date":"2025-12-13","parts":["足本 Full (HKT 18:00 - 20:00)","第一部份 Part 1 (HKT 18:04 - 19:00)","第二部份 Part 2 (HKT 19:04 - 20:00)"]},{"id":"1064803","title":"6/12/2025-12/12/2025","date":"2025-12-06","parts":["足本 Full (HKT 18:00 - 20:00)","第一部份 Part 1 (HKT 18:04 - 19:00)","第二部份 Part 2 (HKT 19:04 - 20:00)"]},{"id":"1063115","title":"29/11/2025-5/12/2025","date":"2025-11-29","parts":["足本 Full (HKT 18:00 - 20:00)","第一部份 Part 1 (HKT 18:04 - 19:00)","第二部份 Part 2 (HKT 19:04 - 20:00)"]},{"id":"1061791","title":"22/11/2025- 28/11/2025","date":"2025-11-22","parts":["足本 Full (HKT 18:00 - 20:00)","第一部份 Part 1 (HKT 18:04 - 19:00)","第二部份 Part 2 (HKT 19:04 - 20:00)"]},{"id":"1059980","title":"15/11/2025-21/11/2025","date":"2025-11-15","parts":["足本 Full (HKT 18:00 - 20:00)","第一部份 Part 1 (HKT 18:04 - 19:00)","第二部份 Part 2 (HKT 19:04 - 20:00)"]},{"id":"1058739","title":"8/11/2025-14/11/2025","date":"2025-11-08","parts":["足本 Full (HKT 18:00 - 20:00)","第一部份 Part 1 (HKT 18:04 - 19:00)","第二部份 Part 2 (HKT 19:04 - 20:00)"]},{"id":"1057221","title":"1/11/2025-7/11/2025","date":"2025-11-01","parts":["足本 Full (HKT 18:00 - 20:00)","第一部份 Part 1 (HKT 18:04 - 19:00)","第二部份 Part 2 (HKT 19:04 - 20:00)"]}]}
